title,text,link,image,pubdate
"உங்கள் பகுதியில் அரசின் காய்கறிகள், பழங்கள் கிடைப்பதில் சிக்கலா? உதவி எண்கள் இதோ!","<p>விவசாயிகள் உற்பத்தி செய்யும், காய்கறிகள் மற்றும் பழங்களை விநியோகிப்பதற்கான அனுமதி பெறுவதிலோ அல்லது சந்தைப்படுத்துவதிலோ ஏதாவது சந்தேகங்கள் மற்றும் சிக்கல்கள் இருந்தால் விவசாயிகளுக்காகவும் காய்கறி மற்றும் பழ விற்பனையாளர்களுக்காகவும் உருவாக்கப்பட்டுள்ள பிரத்தியேக கட்டுப்பாட்டு அறைகளைத் தொடர்பு கொள்ளலாம் என்று அறிவிக்கப்பட்டிருக்கிறது. ஊரடங்கு தொடங்கும் முன்பே இப்படி ஓர் கட்டுப்பாட்டு அறை வேண்டும் என்பதை பசுமை விகடன் இதழ் சுட்டிக் காட்டி வந்தது. இந்த விஷயம் அரசின் கவனத்துக்கும் கொண்டு செல்லப்பட்டது. </p><p>கொரோனா இரண்டாவது அலையைக் கட்டுக்குள் கொண்டுவருவதற்கு தமிழகத்தில் வரும் 31-ம் தேதி வரை முழுமையான ஊரடங்கு அமல்படுத்தப்பட்டிருக்கிறது. இந்த ஊரடங்கு காலத்தில் பொதுமக்களுக்குத் தேவையான காய்கறிகள் பழங்களை வாகனங்கள் மூலம் வினியோகிக்க தமிழக அரசு நடவடிக்கை மேற்கொண்டுள்ளது.</p><figure><img src=""https://gumlet.assettype.com/vikatan/2021-05/b128facf-a002-4b4e-9e65-fc5408d5093e/vikatan_2020_06_30361729_97ad_4383_913f_af684e1734e2_p52c.jpg"" /><figcaption>விவசாயிகள்</figcaption></figure><p>தோட்டக்கலைத் துறை, வேளாண் மற்றும் உழவர் நலத்துறை, வேளாண் விற்பனைத்துறை உள்ளாட்சி அமைப்புகள் மற்றும் இ-வணிக நிறுவனங்கள் மூலமாகக் காய்கறிகள் மற்றும் பழங்கள் பொதுமக்களுக்குத் தங்குதடையின்றி கிடைப்பதற்கு ஏற்பாடு செய்யப்பட்டிருக்கிறது. சென்னை மாநகராட்சி பகுதியில், தினமும் 2,000 வாகனங்களிலும் பிற மாவட்டங்களில் 5,000 வாகனங்களிலும் காய்கறி மற்றும் பழங்கள் வினியோகம் செய்யப்படுகிறது.</p><p>விவசாயிகள், விவசாய குழுக்கள், விவசாய உற்பத்தியாளர் நிறுவனங்கள் வழியே காய்கறிகள் மற்றும் பழங்களைக் கொள்முதல் செய்து விற்பனை செய்வதற்கான வழிவகைகள் செய்யப்பட்டிருக்கின்றன. காய்கறிகளையும் பழங்களையும் ஓரிடத்திலிருந்து மற்றொரு இடத்துக்கு எடுத்துச் செல்ல அனுமதி வழங்கப்பட்டுள்ளது. இதற்கான அனுமதி பெறுவது தொடர்பாகவும் அல்லது விநியோகம் குறித்தும் விவசாயிகளுக்கு ஏதேனும் சந்தேகம் இருந்தால் அதனை நிவர்த்தி செய்வதற்காக தோட்டக்கலை துறை, வேளாண் மற்றும் உழவர் நலத்துறை, வேளாண் விற்பனைத் துறை சார்பாக பிரத்தியேக கட்டுப்பாட்டு அறைகள் தொடங்கப்பட்டுள்ளன.</p><p>சென்னையில் இயங்கி வரும், வேளாண் விற்பனைத்துறை கட்டுப்பாட்டு அறையினை 044 - 2225 3884 என்ற எண்ணிலும் தோட்டக்கலைத் துறை கட்டுப்பாட்டு அறையினை 1800 425 4444 என்ற எண்ணிலும் வேளாண்மைத்துறை கட்டுப்பாட்டு அறையினை 044 - 2859 4338 என்ற எண்ணையும் விவசாயிகளும் வியாபாரிகளும் தொடர்புகொள்ளலாம். (இந்த எண்கள் சரியாக செயல்படுகின்றனவா? என்பதை அறிய தொடர்பு கொண்டு பார்த்தோம். எதிர் முனையில் இருந்த அலுவலர்கள் கனிவுடன் பேசினார்கள்).</p><p>மேலும் அந்தந்த மாவட்டங்களைச் சேர்ந்த வேளாண் விற்பனைத்துறை துணை இயக்குநர்களையும் தோட்டக்கலைத்துறை இணை/ துணை இயக்குநர்களையும் தொடர்புகொள்ளலாம். அவர்களுடைய தொடர்பு எண்களை கீழே உள்ள படத்தில் காணலாம்...</p><figure><img src=""https://gumlet.assettype.com/vikatan/2021-05/b2bd3d22-5211-4e54-9c13-73ce62598d95/df4cdaa1_74de_4ba4_b6e4_f9535e1b0361.jpg"" /></figure><figure><img src=""https://gumlet.assettype.com/vikatan/2021-05/1374d4a1-095e-47a8-8d09-fc0275dd3199/fb859eb3_bf72_4ab1_a2c3_e3db8a1ce725.jpg"" /></figure><p>இதுதொடர்பாக வேளாண் விற்பனைத்துறை மற்றும் தோட்டக்கலைத்துறை அதிகாரிகளிடம் பேசினோம், ``கடந்த ஆண்டு கொரோனா கால ஊரடங்கின்போதே இப்படியான ஹெல்ப் லைன் எண் கொடுக்கப்பட்டது. இப்போது அதனை விரிவுபடுத்தியுள்ளோம். நாளொன்றுக்குச் சராசரியாக 500 அழைப்புகள் வருகின்றனர். விவசாயிகளிடம் உள்ள விளைபொருள்களை விற்பனை செய்வதற்குத் தேவையான அனைத்து வழிகாட்டுதல்களையும் வழங்குகிறோம். பொதுமக்களும் இந்த எண்ணுக்குத் தொடர்புகொண்டு காய்கறி மற்றும் பழங்கள் விநியோகம் குறித்த சந்தேகங்களைக் கேட்டுத் தெரிந்துகொள்கின்றனர் “ என்றனர்.</p>",https://www.vikatan.com/government-and-politics/agriculture/govt-announced-helpline-numbers-to-supply-vegetable-and-fruits-in-this-lockdown,['https://gumlet.assettype.com/vikatan/2019-07/6a399412-e6f0-462d-a255-257d9e909327/vikatan_2019_06_0f7b575b_bcf8_4ee2_9fa7_9ab38f4bcbaa_unnamed__40__15170.jpg'],"Wed, 26 May 2021 14:14:39 +0000"
"`செங்கல்பட்டு தடுப்பூசி நிறுவனத்தை தமிழக அரசு எடுத்து நடத்த நடவடிக்கை'
- அமைச்சர் மா.சுப்பிரமணியன்","<p>நெல்லை மாவட்டத்தில் கொரோனா தடுப்பு நடவடிக்கைகள் குறித்து சுகாதாரத்துறை அமைச்சர் மா.சுப்பிரமணியன் ஆய்வு செய்தார். சபாநாயகர் அப்பாவு, நாடாளுமன்ற உறுப்பினர் ஞானதிரவியம், சுகாதாரத்துறை செயலாளர் ராதாகிருஷ்ணன், மாவட்ட கலெக்டர் விஷ்ணு மற்றும் அதிகாரிகள்  ஆய்வில் பங்கேற்றனர். </p><figure><img src=""https://gumlet.assettype.com/vikatan/2021-05/20d56073-cc32-40f9-9343-5c41f59a6f58/minister_1.jpg"" /><figcaption>கூடங்குளம் மருத்துவமனையில் ஆய்வு</figcaption></figure><p>கூடங்குளம் அரசு ஆரம்ப சுகாதார நிலையம், வள்ளியூர் அரசு மருத்துவமனை உள்ளிட்ட இடங்களில் ஆய்வு நடந்தது. கூடங்குளத்தில் உள்ள 130 படுக்கைகள் கொண்ட மருத்துவமனையில் <a href=""https://www.vikatan.com/news/general-news/ministers-inspection-on-covid-prevention-steps-in-nellai"">கொரோனா பாதிப்பால் சிகிச்சை</a>  பெற்று வருபவர்களுக்கு அளிக்கப்படும் சிகிச்சை, உணவு உள்ளிட்டவை குறித்து காணொலி வாயிலாக அமைச்சர் மா.சுப்பிரமணியன் கேட்டறிந்தார்.</p><p>பின்னர் செய்தியாளர்களிடம் பேசிய அவர்,``தமிழகம் முழுவதும் தடுப்பூசி போட்டுக் கொள்பவர்களின் எண்ணிக்கை நாளுக்கு நாள் உயர்ந்து வருகிறது. நேற்று ஒரே நாளில் மட்டும் தமிழகம் முழுவதும் 2,53,000 பேர் தடுப்பூசி போட்டுக் கொண்டிருக்கிறார்கள். இதுவரை தமிழகத்தில் 75 லட்சம் பேர் தடுப்பூசி செலுத்திக் கொண்டிருக்கிறார்கள். </p><figure><img src=""https://gumlet.assettype.com/vikatan/2021-05/c053cf6f-ade5-4d1a-be04-addc1fac0fa0/minister_3.jpg"" /><figcaption>செய்தியாளர்களுக்கு பேட்டியளித்த அமைச்சர்</figcaption></figure><p>18 முதல் 44 வயது உடையவர்களுக்குத் தடுப்பூசி போடுவதற்காகத் தமிழக அரசின் சார்பில் 85.47 கோடி செலவில் 25 லட்சம் டோஸ் தடுப்பூசி பெறப்பட்டுள்ளது. அதனால் கிராமப்புறங்களில் உள்ள மக்களும் தடுப்பூசி செலுத்துவதற்கான நடவடிக்கைகள் எடுக்கப்பட்டு வருகின்றன். இது தவிர, அடுத்த 6 மாதங்களில் 3.5 கோடி தடுப்பூசிகள் பெறுவதற்கான டெண்டர் நடவடிக்கைகளும் தொடங்கப்பட்டு விட்டன. இன்னும் ஆறு மாத காலத்தில் தடுப்பூசி போடாதவர்களே தமிழகத்தில் இல்லை என்ற நிலை உருவாகும்.</p><p>சுகாதாரத் துறையில் கடந்த பத்து வருடங்களில் இல்லாத வகையில், மருத்துவர்கள் அவர்கள் விரும்பிய இடங்களுக்கு கவுன்சிலிங் மூலம் இடமாறுதல் பெறுவதற்கு வகை செய்யப்பட்டுள்ளது. வெளிப்படையாகக் கலந்தாய்வு நடத்தி மருத்துவர்களுக்கு இடமாறுதல் அளிக்கப்பட்டு வருவதற்கு மருத்துவத் துறையினர் வரவேற்புத் தெரிவித்து வருகிறார்கள். முதுநிலை மருத்துவ மாணவர்களுக்கும் இதே முறையில் இடமாறுதல் பெற நடவடிக்கை எடுக்கப்படும். </p><p>கூடங்குளம் அரசு ஆரம்ப சுகாதார நிலையத்தில் ஆய்வு மேற்கொண்டபோது அங்கு ஏற்கெனவே செயல்பட்ட மகப்பேறு சேவைப் பிரிவு வேறொரு கிராமத்துக்கு மாற்றப்பட்டு விட்டதாகவும் அதனால் தங்களுக்கு மகப்பேறு சேவை தேவை என்றும் மக்கள் தெரிவித்தனர். அதனால் கூடங்குளம் மருத்துவமனையில் மகப்பேறு சேவை தொடங்க நடவடிக்கை எடுக்கப்பட்டுள்ளது.</p><p>கூடங்குளம் அரசு மருத்துவமனையில் தற்போது  86 பேர் <a href=""https://www.vikatan.com/news/general-news/ministers-inspection-on-covid-prevention-steps-in-nellai"">கொரோனா பாதிப்புக்கு  சிகிச்சை</a> பெற்று வருகிறார்கள். அந்த மருத்துவமனையில் பேரிடர் கால சிகிச்சைகள் அளிக்கப்பட்டு வருவதால் கூடுதல் படுக்கை வசதி மட்டுமல்லாமல் மருத்துவமனையிலேயே ஆக்ஸிஜன் உற்பத்தி செய்வதற்கான வசதியும் உருவாக்கப்படும். </p><figure><img src=""https://gumlet.assettype.com/vikatan/2021-05/a6f15a0d-f5c1-4081-9901-1128aa284097/minister_2.jpg"" /><figcaption>சபாநாயகர் மற்றும் சுகாதாரத்துறை செயலருடன் அமைச்சர்</figcaption></figure><p>ஒருங்கிணைந்த நெல்லை மாவட்டத்தில் செயல்பட்டு வந்த சுகாதாரத்துறை இணை இயக்குநர் அலுவலகம் தற்போது தென்காசி மாவட்டத்துக்குச் சென்றுவிட்டதால் நெல்லை மாவட்டத்தில் உள்ள வள்ளியூரில் சுகாதாரத்துறை இணை இயக்குநர் அலுவலகம் அமைக்க நடவடிக்கை எடுக்கப்படும்.</p><p>தமிழக முதல்வர் உத்தரவின் பேரில் கொரோனா பாதித்த மாவட்டங்களுக்கு கூடுதல் அதிகாரிகள் நியமிக்கப்பட்டு கொரோனா பரவலைக் கட்டுப்படுத்த நடவடிக்கை எடுக்கப்பட்டு வருகிறது. அரசின் தொடர் நடவடிக்கைகள், தடுப்பூசி மற்றும் தளர்வில்லா ஊரடங்கு காரணமாக நோய்த் தொற்று படிப்படியாகக் குறைந்து வருகிறது.</p><figure><img src=""https://gumlet.assettype.com/vikatan/2021-05/047fed78-8b62-4c63-9ec2-62d887f3b345/minister_4.jpg"" /><figcaption>அதிகாரிகளுக்கு ஆலோசனை வழங்கும் அமைச்சர் </figcaption></figure><p>செங்கல்பட்டில் செயல்பட்ட தடுப்பூசி தயாரிப்பு நிறுவனம் கடந்த 10 வருடங்களாக சட்டச் சிக்கல் காரணமாக மூடப்பட்டுக் கிடந்தது. அதை முதல்வர் நேரில் ஆய்வு செய்து சட்டப்  பிரச்னைகளை தீர்த்து தமிழக அரசே அதை கையில் எடுத்து மத்திய அரசின் அனுமதியுடன் தடுப்பூசி தயாரிக்க நடவடிக்கை எடுக்கப்பட்டுள்ளது. அது நிறைவேறுமானால் தமிழகத்துக்கு கூடுதல் வரப்பிரசாதமாக அமையும்” என்று அமைச்சர் மா.சுப்பிரமணியன் தெரிவித்தார்.</p>",https://www.vikatan.com/news/general-news/steps-are-on-to-run-chengalpattu-vaccine-centre-by-tamilnadu-government,['https://gumlet.assettype.com/vikatan/2021-05/b2f9bed4-a2d7-41f7-9baf-eaef1a66478c/minister.jpg'],"Wed, 26 May 2021 14:02:34 +0000"
"புதுச்சேரி: ’அனைத்து ரேஷன் கார்டுகளுக்கும் ரூ.3,000!’ கொரோனா நிதியை அறிவித்தார் முதல்வர் ரங்கசாமி","<p>புதுச்சேரியின் 15-வது சட்டப்பேரவை தேர்தலில் பா.ஜ.கவுடன் கூட்டணி வைத்து தேர்தலை சந்தித்த ரங்கசாமி, கடந்த 7-ம் தேதி முதல்வராக பதவியேற்றார். அதன்பிறகு கொரோனா தொற்று காரணமாக அவர் மருத்துவமனையில் அனுமதிக்கப்பட்டதால் எம்.எல்.ஏக்கள் பதவியேற்பு தாமதானது. பா.ஜ.கவுடன் அமைச்சரவை பங்கீட்டு விவகாரத்திலும் இழுபறி நிலவுவதால் அமைச்சரவையும் பதவியேற்கவில்லை.</p><figure><img src=""https://gumlet.assettype.com/vikatan/2019-11/7f034487-9cf6-4bf9-9572-c3e4072f82e3/001.JPG"" /><figcaption>புதுச்சேரி அரசு சட்டப்பேரவை </figcaption></figure><p>சிகிச்சை முடிந்து புதுச்சேரி திரும்பிய ரங்கசாமி தற்காலிக சபாநாயகராக தங்கள் கட்சியைச் சேர்ந்த எம்.எல்.ஏ லட்சுமிநாராயணனை பரிந்துரைத்தார். அவரது பரிந்துரையின்படி ஆளுநர் தமிழிசை சௌந்தரராஜன் லட்சுமிநாராயணனுக்கு பதவிப்பிரமாணம் செய்துவைத்தார். தொடர்ந்து முதல்வர் ரங்கசாமி உள்ளிட்ட தேர்ந்தெடுக்கப்பட்ட 30 எம்.எல்.ஏக்களும், மத்திய அரசு நியமித்த 3 நியமன எம்.எல்.ஏக்களுக்கு பதவிப்பிரமாணம் செய்துவைத்தார் தற்காலிக சபாநாயகர் லட்சுமி நாராயணன்.</p><p>தொடர்ந்து செய்தியாளர்களுக்காக முதல்வர் ரங்கசாமி வெளியிட்ட வீடியோ செய்தியில், ``கொரோனா தொற்றின் இரண்டாவது அலையால் புதுச்சேரி மக்கள் கடுமையாக பாதிக்கப்பட்டிருக்கின்றனர். அதனைக் கட்டுப்படுத்தும் நடவடிக்கையாக ஊரடங்கு உத்தரவை அரசு அமல்படுத்தியிருக்கிறது. அதனால் மக்கள் பொருளாதார ரீதியில் எதிர்கொள்ளும் சிக்கலை தவிர்க்கும் வகையில், புதுச்சேரியைச் சேர்ந்த அனைத்து ரேஷன் கார்டுதாரர்களுக்கும் ரூ.3,000 வழங்கப்படும்.</p><p>Also Read: <a href=""https://www.vikatan.com/government-and-politics/politics/puducherry-cm-rangasamy-tested-corona-positive-and-admitted-in-chennai"">புதுச்சேரி: `முதல்வர் ரங்கசாமிக்கு கொரோனா பாசிட்டிவ்!’ - தொடர் காய்ச்சலால் சென்னையில் சிகிச்சை</a></p> <p>புதுச்சேரியிலுள்ள மொத்தம் 3,50,000 குடும்பத்தினருக்கு இந்த நிவாரண தொகை விரைவில் வழங்கப்படும். அதேபோல் கொரோனா தொற்றினால் உயிரிழந்தவர்களின் குடும்பத்தினருக்காக அரசு ஏற்கெனவே அறிவித்திருக்கும் நிவாரண தொகையையும் உடனடியாக வழங்குவதற்கு ஏற்பாடுகள் செய்யப்படும். மக்கள் தாங்களாகவே தங்களை பாதுகாத்துக் கொண்டால்தான் கொரோனா தொற்றில் இருந்து எளிதில் தப்பிக்க முடியும்” என்றார்.</p>",https://www.vikatan.com/government-and-politics/news/puducherry-cheif-minister-rangasamy-announces-3000-rs-as-corona-relief,['https://gumlet.assettype.com/vikatan/2021-05/b89653e5-29d2-4d51-bb49-e609f47090de/1622017278812.jpg'],"Wed, 26 May 2021 13:10:40 +0000"
