title,text,link,image,pubdate
சுய இன்ப காட்சியில் நடித்தது எப்படி?: சூப்பர் ஹிட் பட நடிகை விளக்கம்,"<img src=""https://tamil.samayam.com/photo/83574042/photo-83574042.jpg"" /><div class=""section1""><div class=""Normal"">அனுராக் கஷ்யப், ஜோயா அக்தர், திபாகர் பானர்ஜி, கரண் ஜோஹர் ஆகிய நான்கு பேர் இயக்கிய நான்கு குறும்படங்களின் தொகுப்பான  ஆந்தாலஜி வெளியாகி வெற்றி பெற்றது. அதிலும் குறிப்பாக கரண் ஜோஹாரின் குறும்படத்தில்  சுய இன்பம் அனுபவித்த காட்சி வைரலானது.

கதைப்படி  தான் கியாரா அத்வானியின் கணவர். ஆனால் அவரால் தன் மனைவியின் செக்ஸ் தேவையை பூர்த்தி செய்ய முடியவில்லை. இதையடுத்து கியாரா சுய இன்பம் அனுபவிப்பார். ஆனால் அதை குடும்பத்தார் பார்த்துவிடுவார்கள்.

அந்த காட்சியில் நடித்தது பற்றி கியாரா அத்வானி நடிகை நேஹா தூபியாவின் நிகழ்ச்சியில் கூறியதாவது,

சுய இன்ப காட்சி சிறப்பாக வர கரண் ஜோஹர் தான் காரணம். எப்படி நடிக்க வேண்டும் என்று அவர் தான் நடித்துக் காட்டினார். சுய இன்ப காட்சியில் நடிக்கும் போது நான் சிரித்துவிடக் கூடாது என்பதற்காக செட்டில் ஒரு சிலர் தான் இருந்தார்கள்.

சின்சியராக பண்ணு என்றார் கரண். வைப்ரேட்டரை பயன்படுத்துவது எப்படி என்று எனக்கு தெரியவில்லை. இதையடுத்து கூகுள் செய்து கண்டுபிடித்தேன். இது போன்ற காட்சிகள் இருக்கும் சில படங்களையும் பார்த்தேன். அதன் பிறகு தான் சுய இன்ப காட்சியில் என்னால் நடிக்க முடியும் என்கிற நம்பிக்கை வந்தது. 

அந்த காட்சிக்கு பல டேக்குகள் போகவில்லை. நடிப்பது கஷ்டம் தான் என்றாலும் நடித்தேன் என்றார்.

லஸ்ட் ஸ்டோரீஸுக்கு பிறகு கியாராவும், விக்கியும் பாலிவுட்டில் பிரபலமாகிவிட்டார்கள். அர்ஜுன் ரெட்டி படத்தின் இந்தி ரீமேக்கான கபீர் சிங்கில் ஷாஹித் கபூர் ஜோடியாக நடித்து பட்டிதொட்டி எல்லாம் பிரபலமாகிவிட்டார் கியாரா. 





</div></div>",https://tamil.samayam.com/tamil-cinema/bollywood/this-is-how-kiara-advani-acted-in-masturbation-scene-in-lust-stories/articleshow/83574042.cms,['https://tamil.samayam.com/photo/83574042/photo-83574042.jpg'],"Wed 16 Jun 2021, 18:25:07"
``அமைச்சர்கள் எழுந்து நின்று என்னை வரவேற்றார்கள்’’- திருத்துறைப்பூண்டி எம்.எல்.ஏ மாரிமுத்து,"<p>திருத்துறைப்பூண்டி தொகுதி சட்டமன்ற உறுப்பினர் மாரிமுத்து, தனது தொகுதி மக்களின் கோரிக்கை தொடர்பாக, நேற்று வருவாய்த்துறை அமைச்சர் கே.கே.எஸ்.எஸ்.ஆர்.ராமச்சந்திரன், பொதுப்பணித்துறை மற்றும் நெடுஞ்சாலைத்துறை அமைச்சர் எ.வ.வேலு ஆகியோரைச் சந்தித்து மனு அளித்தார். இது தொடர்பான புகைப்படங்களைத் தனது முகநூல் பக்கத்தில் எம்.எல்.ஏ மாரிமுத்து பதிவிட்டிருந்தார். அதில் அமைச்சர்கள் நாற்காலியில் அமர்ந்தவாறு மனுவைப் பெற்றுக்கொண்ட காட்சியைப் பார்த்து பலரும் சமூக வலைதளங்களில் கண்டனம் தெரிவித்திருந்தார்கள்.  குறிப்பாக, இந்திய கம்யூனிஸ்ட் கட்சிப் பிரமுகர் சந்திரகுமார், தனது முகநூல் பக்கத்தில் இந்தப் படங்களை பதிவிட்டு,  `தொகுதி மக்களின் தேவைகளை நிறைவேற்ற, அமைச்சர்களைச் சந்தித்து, கோரிக்கை விண்ணப்பம் அளித்துவரும் எம். எல்.ஏ மாரிமுத்துவின் முயற்சி, பாராட்டுக்குரியது. இதை நிறைவேற்ற உறுதியளித்த அமைச்சர்களுக்கும் நன்றி தெரிவிப்போம். ஆனால் அமைச்சர்கள் கோரிக்கை விண்ணப்பத்தை,  சட்டமன்ற உறுப்பினரிடம் எழுந்து நின்று பெற்றிருக்க வேண்டும் அல்லது சட்டமன்ற உறுப்பினரை அமரச்செய்து மனுவைப் பெற்றிருக்க வேண்டும். அமைச்சர்கள் தேவையற்ற விமர்சனங்களுக்குள்ளாவதைத் தவிர்க்க வேண்டுகிறோம்’ எனத் தெரிவித்திருந்தார். இந்தநிலையில், அமைச்சர்கள் தன்னிடம் மிகுந்த மதிப்புடனும் அன்போடும் நடந்துகொண்டதாகவும், அவசரத்தில் எடுத்த புகைப்படத்தால்தான் இந்தச் சர்ச்சை எழுந்துள்ளதாகவும் விளக்கம் அளித்துள்ளார் திருத்துறைப்பூண்டி எம்.எல்.ஏ மாரிமுத்து.</p><figure><img src=""https://gumlet.assettype.com/vikatan/2021-06/02a47cb3-e478-4276-a728-ca5b170a4e98/baa8c246-f5de-43be-8889-f9070e603673.jpg"" /><figcaption>எம்.எல்.ஏ மாரிமுத்து- அமைச்சர் கே.கே.எஸ்.எஸ்.ஆர்.ராமச்சந்திரன்</figcaption></figure><p>``நேற்று சட்டப்பேரவை நிகழ்ச்சி முடிவுற்றதும், திருத்துறைப்பூண்டி புறவழிச் சாலைப் பணிகளை விரைந்து தொடங்க வேண்டிய கோரிக்கைக்காக மாண்புமிகு பொதுப்பணிதுறை மற்றும் நெடுஞ்சாலைத்துறை அமைச்சர் திரு எ.வ.வேலு அவர்களைச் சந்தித்து விண்ணப்பம் கொடுக்க அவரது அறைக்குச் சென்றேன். அப்போது அவர் என்னை எழுந்து நின்று வரவேற்று, எதிரிலிருந்த இருக்கையைக் காட்டி அமரும்படி கேட்டுக்கொண்டார். நான் மேலும் சில அமைச்சர்களையும், முதலமைச்சரையும் சந்திக்க வேண்டிய அவசரம் காரணமாக நின்றபடியே கோரிக்கை விண்ணப்பத்தைக் கொடுத்துவிட்டுத் திரும்பினேன். மேலும், அதைத் தொடர்ந்து முத்துப்பேட்டை தனி தாலுகா கோரிக்கைக்காக மாண்புமிகு வருவாய்த்துறை மற்றும் பேரிடர் மேலாண்மைத்துறை அமைச்சர் திரு கே.கே.எஸ்.எஸ்.ஆர்.ராமச்சந்திரன்  அவர்களைச் சந்தித்து மனு கொடுக்கச் சென்றபோது, மாண்புமிகு அமைச்சர் அவர்களும் என்னை அமரச்சொன்னார். சிறிது நேரம் பேசிக்கொண்டிருந்தோம். அப்போது என்னிடம் மிகுந்த அக்கறையோடு விசாரித்ததோடு,  அமைச்சர் என்ற முறையில், `எப்போது வேண்டுமானாலும் தொடர்பு கொள்ளுங்க. எதுவானாலும் செய்து தருகிறேன். அவைக்குப் புதியவர் என்ற தயக்கம் வேண்டாம்’ என எனக்கு ஊக்கமளித்து, கனிவாகப் பேசினார். அப்போது அவர் எழுவதற்குள் மூத்த அமைச்சர் என்பதால் நானே எழுந்து மனு அளித்தேன். அதன் பிறகும் அவசரமாக வேறு பணிக்குச் சென்றேன். உண்மைநிலை இவ்வாறிருக்க, அவரசத்தில் எடுத்த புகைப்படங்கள் வெளியானதால் இந்தச் சர்ச்சை எழுந்துள்ளது. இது வருத்தமளிக்கிறது’’ எனத் தெரிவித்துள்ளார்.</p>",https://www.vikatan.com/news/politics/mla-marimuthus-explanation-about-his-meeting-with-ministers,['https://gumlet.assettype.com/vikatan/2021-06/713ae7c1-9f0b-4ac1-b9a1-bd942a4a55b8/c771f485-01e3-4e83-82be-a4e9c7e4bc12.jpg'],"Thu, 24 Jun 2021 16:08:03 +0000"
திருவாரூர்: ஏ.டி.எம் மெஷினிலிருந்து பணம் கொள்ளை; சிசிடிவி-யால் சிக்கிய நபர்!,"<p>திருவாரூர் மாவட்ட ஆட்சியர் அலுவலகம் அருகே இந்தியன் ஓவர்சீஸ் வங்கிக் கிளை செயல்பட்டுவருகிறது. இதனுடன் ஏ.டி.எம் மையமும் செயல்பட்டுவருகிறது. இங்குள்ள ஏ.டி.எம் இயந்திரத்தில் கடந்த 14-ம் தேதி பணம் நிரப்புவதற்காக, வங்கி அலுவலர்கள் வந்து பார்த்தபோது, இதில் ரூ.2,05,700 கொள்ளையடிக்கப்பட்டிருப்பது தெரியவந்திருக்கிறது. மெஷினை உடைக்காமலேயே பணத்தைக் கொள்ளையடித்துச் சென்றது யாராக இருக்கும் என்று வங்கி அலுவலர்கள் அதிர்ச்சி அடைந்தார்கள். இது தொடர்பாக, திருவாரூர் தாலுகா காவல் நிலையத்தில் வங்கித் தரப்பில் புகாரளிக்கப்பட்டது.</p><figure><img src=""https://gumlet.assettype.com/vikatan/2021-06/5a715a13-5286-474e-8c5e-f126c20f4cec/IMG_20210624_184734.jpg"" /><figcaption>கைதுசெய்யப்பட்ட இளையராஜா</figcaption></figure><p>விசாரணையில் இறங்கிய காவல்துறையினர், சிசிடிவி கேமராவில் பதிவான காட்சிகளை ஆய்வு செய்தனர். அதில், கடந்த 12-ம் தேதி வங்கியில் ஒப்பந்த அடிப்படையில் பணியாற்றிவரும் துப்புரவுப் பணியாளர் இளையராஜா என்பவர், காலை 8 மணிக்கு வங்கியின் மேலாளர் அறைக்குச் சென்று அங்கிருந்த ஏ.டி.எம் மெஷினின் சாவியையும், பாஸ்வேர்டு எழுதிவைத்திருந்த பேப்பரையும் எடுத்துச் செல்வது தெரியவந்ததாக காவல்துறையினர் தெரிவிக்கிறார்கள். இவர்தான் ஏ.டி.எம் மெஷினிலிருந்து பணத்தைத் திருடிச் சென்றதாக குற்றம்சாட்டுகிறார்கள். இது குறித்து இளையராஜாவிடம் விசாரணை மேற்கொண்டபோது, ஏ.டி.எம் மெஷினிலிருந்து பணம் திருடியதை அவர் ஒப்புக்கொண்டதாகக் காவல்துறையினர் தெரிவிக்கிறார்கள். இளையாராஜாவிடமிருந்து 1,80,700 ரூபாய் மீட்கப்பட்டு, அவர் சிறையில் அடைக்கப்பட்டுள்ளார்.</p>",https://www.vikatan.com/news/crime/atm-robbery-at-thiruvarur-person-trapped-by-cctv-footage,['https://gumlet.assettype.com/vikatan/2021-06/d39f3aba-6983-4723-aaa0-f057cb316f98/d001c519-f481-419a-83d8-9b6a36e0976f.png'],"Thu, 24 Jun 2021 14:12:28 +0000"
