title,text,link,image,pubdate
வேலூர்:`ரூ.6 லட்சம் பணத்துக்கு ஆசை!’ - தொழிலாளி கொலையில் சிக்கிய மைத்துனர்,"<p>வேலூர், கஸ்பா ஃபையர்லைன் பகுதியைச் சேர்ந்தவர் ராஜன். இவருக்கு வயது 34. கூலித் தொழில் செய்துவந்த ராஜன், கடந்த வாரம் திடீரென மாயமானார். குடும்பத்தினர் அவரைத் தேடிவந்த நிலையில், கடந்த 10-ம் தேதி சித்தேரி ரயில்வே கேட்டுக்கு அருகேயுள்ள விவசாயக் கிணற்றிலிருந்து அழுகிய நிலையில் சடலமாகக் கண்டெடுக்கப்பட்டார். சடலத்தின் கை கால்கள் கட்டப்பட்டிருந்ததால், கொலையெனத் தெரியவந்தது. அரியூர் போலீஸார் உடலை மீட்டு பிரேத பரிசோதனைக்காக வேலூர் அரசு மருத்துவமனைக்கு அனுப்பிவைத்தனர். மேலும், வழக்கு பதிந்து விசாரணையைத் தீவிரப்படுத்தியபோது, ராஜன் கொலைக்கான திடுக்கிடும் தகவல்கள் வெளிவந்தன.</p><figure><img src=""https://gumlet.assettype.com/vikatan/2021-04/412d8812-b1eb-4e03-8cb5-378c4f4735a7/WhatsApp_Image_2021_04_13_at_9_46_52_AM.jpeg"" /><figcaption>கொலை செய்யப்பட்ட ராஜன்</figcaption></figure><p>ராஜனை அவரின் தங்கை கணவர் குமார் என்பவரே தீர்த்துகட்டியிருப்பது தெரியவந்தது. குமார் நேற்று மாலை கைதுசெய்யப்பட்டார். இந்தச் சம்பவம் குறித்து போலீஸ் தரப்பில் கூறியதாவது, ‘``கொலை செய்யப்பட்ட ராஜனின் தாய் லட்சுமி துப்புரவுப் பணியாளராக வேலூர் மாநகராட்சியில் வேலை செய்துவந்தார். கடந்த இரண்டு ஆண்டுகளுக்கு முன்பு தாய் இறந்துவிட அவருக்கான பணப்பலன் 6 லட்சம் ரூபாய் வர வேண்டியிருந்தது. அந்தப் பணத்தை பெறுவதில் ராஜனுக்கும், அவரின் தங்கை உஷாவுக்கும் தகராறு ஏற்பட்டிருக்கிறது.</p><p>மாமியார் லட்சுமி பணியின்போது, மரணமடைந்திருப்பதால் அந்த வேலையை வாரிசு அடிப்படையில் தன் மனைவிக்குப் பெற்றுத்தர குமார் நினைத்திருக்கிறார். இதற்கும் ராஜன் இடையூறாக இருந்திருக்கிறார். இது தொடர்பான விரோதம் முற்றியநிலையில், ராஜனைக் கொலை செய்யத் திட்டமிட்டிருக்கிறார் தங்கையின் கணவர் குமார். திட்டமிட்டபடி, கடந்த 7-ம் தேதி ராஜனைப் பென்னாத்தூருக்கு அழைத்துச் சென்ற குமார் அங்கு மது வாங்கிக்கொண்டு சித்தேரி அருகே அமர்ந்து ஊற்றிக் கொடுத்திருக்கிறார்.</p><figure><img src=""https://gumlet.assettype.com/vikatan/2021-04/e18b4fd2-8946-4367-87c0-0412ee870dca/WhatsApp_Image_2021_04_13_at_9_46_52_AM__1_.jpeg"" /><figcaption>கைதுசெய்யப்பட்ட குமார்</figcaption></figure><p>அளவுக்கு அதிகமாக மது குடித்த ராஜன், தடுமாற ஆரம்பித்தார். இதுதான் சரியான நேரம் என்று முடிவெடுத்த மைத்துனர் குமார், ராஜனின் கைகால்களைக் கயிற்றால் கட்டி தரதரவென இழுத்துச் சென்று அருகிலிருந்த கிணற்றுக்குள் வீசியதாகக் கூறப்படுகிறது. `<a href=""https://www.vikatan.com/news/tamilnadu"">தொல்லை ஒழிந்துவிட்டது’ என்று நிம்மதிப் பெருமூச்சுவிட்ட குமார், மாமியாரின் பணப்பலனும் கிடைத்துவிடும். வாரிசு அடிப்படையில் மனைவிக்கு வேலையையும் வாங்கிவிடலாம் என்று பதற்றமே இல்லாமல் சுற்றித் திரிந்தபோது, வசமாக சிக்கிக்கொண்டார்</a> என்று விவரிக்கிறது காவல்துறை. ராஜா கொலையில் அவரின் தங்கைக்கும் தொடர்பிருக்கிறதா என்ற கோணத்திலும் போலீஸார் விசாரணை மேற்கொண்டுவருகிறார்கள்.</p>",https://www.vikatan.com/news/crime/in-worker-mystery-death-case-relative-arrested,https://gumlet.assettype.com/vikatan/2021-04/2e8e1e9b-12c2-42e3-98e3-e2a19fb7b988/WhatsApp_Image_2021_04_13_at_9_46_52_AM__1_.jpeg,"Tue, 13 Apr 2021 10:21:38 +0000"
வேளச்சேரியில் பைக்கில் வாக்கு இயந்திரங்கள்.. ஒரு வாக்குச்சாவடியில் மறுதேர்தல்.. தேர்தல் ஆணையம் அதிரடி.!,"சென்னையில் வேளச்சேரி தொகுதிக்குட்பட்ட தரமணி 100அடி சாலையில் தேர்தல் தினத்தன்று இருசக்கர வாகனத்தில் சிலர் வாக்குப்பதிவு இயந்திரங்களை எடுத்துச் சென்றனர். இதைக் கண்ட திமுகவினர், பொதுமக்கள் உதவியுடன் அவர்களை மடக்கிப்பிடித்தனர். இதனையடுத்து காவல்நிலையத்திற்கு தகவல் அளிக்கப்பட்டது. இந்தச் சம்பவம் பெரும் பரபரப்பை ஏற்படுத்திய நிலையில், இச்சம்பவத்துக்கு எதிராக காங்கிரஸ் வேட்பாளர் ஹசன் மவுலானா மற்றும் திமுக கூட்டணிக் கட்சியினர் சாலை மறியலில் ஈடுபட்டனர்.&nbsp; இந்தச் சம்பவம் தொடர்பாக திமுக எம்.எல்.ஏ மா.சுப்பிரமணியன், மக்கள் நீதி மய்யம் கட்சி வேட்பாளர் சரத்பாபு உள்ளிட்டவர்கள் தேர்தல் அதிகாரி சத்யபிரதா சாஹூவை சந்தித்து புகார் அளித்தனர். இதனையடுத்து இந்தச் சம்ப்வம் தொடர்பாக விசாரித்த தேர்தல் ஆணையம், அஜாக்கிரதையாக மாநகராட்சி ஊழியர்கள் வாக்கு இயந்திரங்களை எடுத்துச் சென்றதாகவும், அந்த வாக்கு இயந்திரத்தில் 15 வாக்குகள் பதிவாகியிருந்ததாகவும் தேர்தல் அதிகாரி சாஹூ தெரிவித்திருந்தார். இந்தச் சம்பவம் தொடர்பாக தலைமை தேர்தல் ஆணையத்துக்கும் மாநில தேர்தல் அதிகாரி அறிக்கை அனுப்பினார். இந்நிலையில் வேளச்சேரி தொகுதியில் வாக்குச்சாவடி எண் 92-ல் ஏப்ரல் 17 அன்று மறு வாக்குப்பதிவு நடைபெறும் என்று தேர்தல் ஆணையம் அதிரடியாக அறிவித்துள்ளது. ஏப்ரல் 17 காலை 7 மணி முதல் மாலை 7 மணி வரை இந்த வாக்குப்பதிவு நடக்கும் என்றும் தெரிவிக்கப்பட்டுள்ளது.",https://tamil.asianetnews.com/politics/ballot-voting-machines-in-velachery-re-election-at-a-polling-station-election-commission-action--qrifi4,https://static.asianetnews.com/images/01f2qzkhpsfvxjk4a4d7d45a24/1-jpeg_760x400.jpg,"Tue, 13 Apr 2021 09:38:29 +0530"
சுப்புலட்சுமி ஜெகதீசனுக்கு சபாநாயகர் பதவி... ஓவர் ஸ்பீடில் திமுகவில் திகுதிகு காட்சி..!,"தமிழகத்தில் கடந்த 6-ஆம் தேதி சட்டப்பேரவைத் தேர்தல் நடந்தது. தேர்தலில் 72.78 சதவீத வாக்குகள் பதிவாயின. வாக்குப்பதிவு எண்ணிக்கை மே 2ஆம் தேதி நடைபெற உள்ளது. தேர்தலில் எந்தக் கட்சி வெற்றி பெறும் என்பது அறிய காத்திருக்க வேண்டிய சூழல் ஏற்பட்டுள்ளதால், முடிவை அறிய அதுவரை அரசியல் கட்சிகள் பொருத்திருக்க வேண்டிய நிலை உள்ளது. ஆனால், தேர்தலுக்கு முன்பு வெளியான கருத்துக்கணிப்புகளில் எல்லாம் திமுக ஆட்சியைக் கைபற்றும் என்று தெரிவித்தன. திமுகவுக்காகப் பணியாற்றிய ஐ-பேக் அமைப்பும் திமுகவே ஆட்சியைப் பிடிக்கும் என்று திமுக தலைமையிடம் ரிப்போர்ட் வழங்கியுள்ளது. எனவே, தேர்தலில் எப்படியும் 180-க்கும் அதிகமான தொகுதிகளில் வெல்வோம் என்ற நம்பிக்கையில் திமுக உள்ளது. அதற்கும் ஒரு படி மேலே சென்று, திமுக ஆட்சியில் அமைச்சர்கள் யார், துறை செயலாளர்கள் யார் என்றெல்லாம் ஆலோசனைகள் நடைபெற்றுவருவதாகத் தகவல்கள் பரபரக்கின்றன. அந்த வகையில் திமுக ஆட்சி அமைந்தால், சபாநாயகராக யாரை நியமிக்கலாம் என்பது குறித்து திமுக தலைமை ஆலோசனை நடத்தியதாகவும், மொடக்குறிச்சி தொகுதியில் போட்டியிட்ட திமுக துணைப் பொதுச்செயலாளர் சுப்புலட்சுமி ஜெகதீசன் அந்தப் பொறுப்புக்கு நியமிக்கப்படுவார் என்றும் திமுகவில் பேச்சுகள் தீவிரமாக பேசப்படுகின்றன. மொடக்குறிச்சி தொகுதியில் சுப்புலட்சுமி ஜெகதீசனை எதிர்த்து பாஜக களமிறங்கியது. மிகவும் சீனியரான சுப்புலட்சுமி, இந்தத் தொகுதியில் சுலபமாக வெல்வார் என்று திமுக நம்புகிறது. எனவே, சுப்புலட்சுமி ஜெகதீசன் தமிழகத்தின் முதல் சபாநாயகராவார் என்று அவருடைய ஆதரவாளர்கள் உறுதிப்பட கூறுகிறார்கள். எது எப்படி இருந்தாலும், மே 2-க்குப் பிறகு இதற்கு விடை கிடைத்துவிடப் போகிறது..!&nbsp; &nbsp;",https://tamil.asianetnews.com/politics/subbulakshmi-jagadeesan-to-be-the-speaker-of-the-tn-assembly-house-scene-in-dmk--qrieft,https://static.asianetnews.com/images/01f35yeqphen3y66s6y7sd1rwt/subbulakshmi-and-stalin-jpg_760x400.jpg,"Tue, 13 Apr 2021 09:15:29 +0530"
"மு.க. ஸ்டாலின் ஆட்சியில் இதை நிலைநிறுத்துவோம்... மோடி, எடப்பாடி அரசுகளுக்கு வைகோ எச்சரிக்கை..!","இதுதொடர்பாக வைகோ வெளியிட்டுள்ள அறிக்கையில், “சென்னை சென்ட்ரல் ரயில் நிலையம், ரிப்பன் மாளிகை அருகே, நெடுஞ்சாலைத் துறையினர், கிராண்ட் வெஸ்டர்ன் டிரங்க் ரோடு என்று பெயர் பொறித்த பலகையை புதிதாக நாட்டி இருக்கிறார்கள். 1979ஆம் ஆண்டு, பெரியார் நூற்றாண்டு விழாவையொட்டி, ஓராண்டு தொடர் விழாவாக எம்ஜிஆர். தலைமையில் அ.தி.மு.க. அரசு கொண்டாடியது. அப்போது, பூவிருந்தவல்லி நெடுஞ்சாலை என்ற பெயரை ‘பெரியார் ஈ.வெ.ரா. நெடுஞ்சாலை’ என்று மாற்ற, மக்கள் விடுத்த வேண்டுகோளை ஏற்று, முதல்வர் எம்.ஜி.ஆர், அவ்வாறு பெயர் மாற்றம் செய்து அரசு ஆணை பிறப்பித்தார். ஆனால், எம்ஜிஆர் பெயரைச் சொல்லிக்கொண்டு ஆட்சி நடத்துகிற எடப்பாடி பழனிசாமி அரசு, நெடுஞ்சாலைத் துறை இணைய தளத்தில், தந்தை பெரியார் பெயரை நீக்கிவிட்டு ‘கிராண்ட் வெஸ்டன் டிரங்க் ரோடு’ என்று பெயர் மாற்றம் செய்து இருக்கிறது. ஆர்எஸ்எஸ் சங் பரிவார் வகுத்த வியூகத்தின்படி, டெல்லி எஜமான் மோடி பிறப்பித்த ஆணையை, அடிமை எடப்பாடி நிறைவேற்றி இருக்கிறார். தமிழ்நாட்டின் தன்மானத்தை அடகு வைத்துவிட்டார். ஏற்கனவே, சென்னை விமான நிலையத்திலிருந்து, காமராஜர் அண்ணா பெயரை நீக்கியதையும் அடிமை எடப்பாடி அரசு கண்டுகொள்ளவில்லை. அதன் விளைவாக, இப்போது இந்த மாற்றம் நடந்திருக்கிறது. தமிழக முதல்வர் மட்டுமின்றி நெடுஞ்சாலைத் துறைக்கும் பொறுப்பு வகிக்கிற எடப்பாடிக்கு, சூடு சொரணை இருந்தால், தன் பெயரைக் காப்பாற்றிக் கொள்ள, இந்தப் பெயர் மாற்றத்தை உடனே நீக்க வேண்டும். ‘பெரியார் ஈ.வெ.ரா. நெடுஞ்சாலை’ என்ற பெயர் தொடர வேண்டும். தவறினால், மே மாதம் பொறுப்பேற்கிற திமுக ஆட்சி பெரியாரின் பெயரை மீண்டும் நிலைநிறுத்தும்.” என்று வைகோ அறிக்கையில் தெரிவித்துள்ளார். &nbsp;",https://tamil.asianetnews.com/politics/we-will-do-this-under-stalin-s-rule-vaiko-warns-modi-and-edappadi-governments--qrid6h,https://static.asianetnews.com/images/01dte8vsd48h3j359dzjdmnzaw/vaiko212-1549691950-jpg_760x400.jpg,"Tue, 13 Apr 2021 08:48:19 +0530"
அக்கவுண்ட்ல பணம் இல்லாமலேயே ரூ.3 லட்சம் வரை எடுக்கலாம்!!,"<img src=""https://tamil.samayam.com/photo/82032098/photo-82032098.jpg"" /><div class=""section1""><div class=""Normal""> வாங்கும் நபர்களுக்காக சிறப்பு சம்பளக் கணக்குத் திட்டத்தை  அறிமுகம் செய்துள்ளது. இத்திட்டத்தின் கீழ் ஜீரோ பேலன்ஸ் வங்கிக் கணக்கு திறக்கலாம். மத்திய / மாநில அரசு ஊழியர்கள், பொதுத் துறை நிறுவனங்களில் பணியாற்றும் ஊழியர்கள், பன்னாட்டு நிறுவன ஊழியர்கள், அரசு சார்ந்த நிறுவன ஊழியர்கள், மிகவும் புகழ்பெற்ற நிறுவனங்களில் பணியாற்றும் ஊழியர்கள், புகழ்பெற்ற கல்வி நிறுவனங்களில் பணியாற்றும் ஊழியர்கள் இத்திட்டத்தின் கீழ் கணக்கு தொடங்கி பயன் பெறலாம்.

பஞ்சாப் நேஷனல் பேங்க் மை சேலரி அக்கவுண்ட் நான்கு பிரிவுகளாகப் பிரிக்கப்பட்டுள்ளது. சில்வர், கோல்டு, பிரீமியம் மற்றும் பிளாட்டினம். இந்த நான்கு பிரிவுகளிலும் சம்பளம் மற்றும் வாடிக்கையாளரைப் பொறுத்து  வசதி கிடைக்கும்.


<strong>சில்வர்</strong>: ரூ.10,000 முதல் ரூ.25,000 வரை சம்பளம்

<strong>கோல்டு</strong>: ரூ.25,001 முதல் ரூ.75 வரை சம்பளம்

<strong>பிரீமியம்</strong>: ரூ.75,001 முதல் ரூ.1,50,000 வரை சம்பளம்

<strong>பிளாட்டினம்</strong>: ரூ.1,50,001க்கு மேல் சம்பளம்

பஞ்சாப் நேஷனல் வங்கியின்  அக்கவுண்ட் வாடிக்கையாளர்கள் தங்களது கடைசி இரண்டு மாத சம்பளத் தொகையை ஓவர் டிராஃப்ட் வசதியின் கீழ் எடுக்கலாம். அந்தப் பணத்தை அடுத்த ஆறு மாதங்களுக்கு வட்டியுடன் திருப்பிச் செலுத்த வேண்டும். அதன் பின்னர் மீண்டும் அவர்கள் ஓவர் டிராஃப்ட் வசதியைப் பெறமுடியும்.

 

சில்வர் சம்பளக் கணக்கு வாடிக்கையாளர்கள் ரூ.50,000 வரையிலும், கோல்டு சம்பளக் கணக்கு வாடிக்கையாளர்கள் ரூ.1,50,000 வரையிலும், பிரீமியம் சம்பளக் கணக்கு வாடிக்கையாளர்கள் ரூ.2,25,000 வரையிலும், பிளாட்டினம் சம்பளக் கணக்கு வாடிக்கையாளர்கள்  வரையில் எடுக்கலாம்.

இதுமட்டுமல்லாமல், மேற்கூறிய அனைத்து பிரிவு வாடிக்கையாளர்களுக்கும் ரூ.20 லட்சம் வரையில் விபத்து காப்பீடும் வழங்கப்படுகிறது. 

</div></div>",https://tamil.samayam.com/business/business-news/get-up-to-3-lakh-overdraft-facility-on-pnb-account/articleshow/82032098.cms,['https://tamil.samayam.com/photo/82032098/photo-82032098.jpg'],"Tue 13 Apr 2021, 16:38:58"
