title,text,link,image,pubdate
கட்டாயத் திருமணத்தை நிறுத்திய மாணவி 5 நாள்களில் தற்கொலை; பாதுகாக்கத் தவறியதா அரசு?,"<p>``என் திருமணத்தை நிறுத்துங்கள்"" என்று சில நாள்களுக்கு முன் எஸ்.பி-க்கு மெசேஜ் அனுப்பிய பள்ளி மாணவி, அந்தத் திருமணத்திலிருந்து மீட்கப்பட்ட நிலையில், நேற்று தற்கொலை செய்துகொண்ட சம்பவம் பேரதிர்ச்சியை ஏற்படுத்தியுள்ளது.</p><p>மதுரை மாவட்டத்தில் கொரோனா ஊரடங்குக் காலத்தில் அதிகமான அளவில் குழந்தைத் திருமணங்கள் நடந்து வருகின்றன. மக்களிடம் போதிய விழிப்புணர்வு இல்லாத நிலையில், இது குறித்து சமூக ஆர்வலர்களுக்கு வரும் தகவலை அடுத்து, ஒரு சில திருமணங்கள் தடுக்கப்பட்டு பெண் குழந்தைகள் மீட்கப்பட்டு வருகிறார்கள்.</p><figure><img src=""https://gumlet.assettype.com/vikatan/2019-09/71934715-056e-49c7-86f4-227e11e3e680/vikatan_2019_07_dce10f58_eea5_49f2_8152_46dfc282310a_104566_thumb.jpg"" /><figcaption>Girl - Representational Image</figcaption></figure><p>Also Read: <a href=""https://www.vikatan.com/news/crime/arranging-marriage-with-a-40-year-old-man-a-15-year-old-girl-complained-to-the-police-about-her-mother"">₹2 லட்ச கடனை அடைக்க சிறுமிக்கு திருமணம் செய்ய முயன்ற தாய்; போலீஸ் விசாரணை!</a></p><p>இந்நிலையில் கடந்த 11-ம் தேதி மதுரை எஸ்.பி மொபைலுக்கு, ``ப்ளஸ் டூ படித்து வரும் எனக்குக் கட்டாயத் திருமணம் செய்ய உள்ளார்கள். தடுத்து நிறுத்துங்கள்"" என்று மாணவி ஒருவர் மெசேஜ் அனுப்ப, மாணவியின் வீடு மாநகர எல்லைக்குள் வருவதால், இத்தகவல் உடனே மாநகர காவல்துறை அலுவலகத்துக்கு அனுப்பப்பட்டது.</p><p>உடனே களத்தில் இறங்கிய மாநகர காவல்துறையினர், சமூக நலத்துறையினர் மற்றும் குழந்தைகள் நலக்குழுவினர், சம்பந்தப்பட்ட மாணவியின் வீட்டுக்குச் சென்று அவர் பெற்றோரிடம் எச்சரித்தனர். அதைத் தொடர்ந்து, மகளுக்குத் திருமண ஏற்பாடு செய்ய மாட்டோம் என்று பெற்றோர் தரப்பில் எழுதிக் கொடுத்துள்ளனர். அதனால், பெற்றோரிடமே மாணவியை ஒப்படைத்து வந்தனர்.</p><p>இந்நிலையில், நேற்று அந்த மாணவி வீட்டில் தூக்கிட்டு தற்கொலை செய்துகொண்டுள்ளார். தற்போது, மாணவியின் தற்கொலை சம்பந்தமாக அவர் பெற்றோரிடம் காவல்துறையினர் விசாரணை நடத்தி வருகிறார்கள்.</p><figure><img src=""https://gumlet.assettype.com/vikatan/2019-12/814076ed-eff7-4834-b078-5e7836a52f8d/child_marriage_1.jpg"" /><figcaption>குழந்தைத் திருமணம் - Representational Image</figcaption></figure><p>Also Read: <a href=""https://www.vikatan.com/news/crime/4-people-including-parents-arrested-under-pocso-for-child-marriage"">ஊரடங்கு காலத்தில் குழந்தை திருமணம்; போக்சோ சட்டத்தின் கீழ் 4 பேர் கைது!</a></p><p>`தனக்கு வீட்டில் கட்டாயத் திருமணம் செய்து வைக்கப் போகிறார்கள் என்று புகார் தெரிவித்த மாணவியை புகாருக்குள்ளான பெற்றோரிடமே விட்டு வந்தது தவறு, அவரை அரசுக் காப்பகத்தில் பாதுகாப்பாக சேர்த்திருக்க வேண்டும். மீண்டும் அவருக்குத் திருமணம் செய்ய முயற்சி செய்திருக்கலாம் அல்லது பெற்றோர் திட்டியிருக்கலாம். அதனால் மனம் உடைந்து தற்கொலை முடிவை மாணவி எடுத்திருக்கலாம். மாணவியைப் பாதுகாக்க அரசுத் தரப்பு தவறிவிட்டது' என்று சமூக ஆர்வலர்கள் புகார் எழுப்பி வருகிறார்கள்.</p><p>தற்போது இந்தச் சம்பவத்தைக் காவல்துறை விசாரித்து வரும் நிலையில் சமூக நலத்துறை, மாவட்டக் குழந்தைகள் நலக்குழுவும் விசாரித்து வருகிறார்கள்.</p><p>மதுரை மாவட்ட குழந்தைகள் பாதுகாப்புக் குழு உறுப்பினர் பாண்டியராஜனிடம் பேசினோம்.  </p><p>``அந்தச் சிறுமியின் தற்கொலை பற்றி விசாரித்து வருகிறார்கள். பொதுவாகக் குழந்தைத் திருமணங்கள் பற்றிப் புகார் வந்தால் அதைத் தடுத்து அந்தக் குழந்தைக்கு பாதுகாப்பு வழங்க சமூக நலத்துறை, காவல்துறை, சைல்ட் லைன் ஆகியோருடன்  குழந்தைகள் நலக்குழுவும் இணைந்து செயல்படுவோம்.</p><figure><img src=""https://gumlet.assettype.com/vikatan/2021-06/7fdb629e-6b45-456b-a628-e9cd9cc4b9ef/IMG_20210617_144442.jpg"" /><figcaption>பாண்டியராஜன்</figcaption></figure><p>திருமணம் நடந்து முடிந்த குழந்தைகளை அரசு இல்லங்களில் தங்க வைத்துப் பாதுகாப்போம். அவர்களின் கல்வி, எதிர்காலத்துக்கு அரசு உதவிகள் கிடைக்கச் செய்வோம். மன நல ஆலோசனைகள் வழங்குவோம். அதே நேரம், திருமணத்துக்கு முன்பே சிறுமிகள் மீடகப்பட்டால் பெற்றோருக்கு அறிவுறுத்துவோம். அக்குழந்தை படிக்க விரும்பினால் அதற்கு ஏற்பாடு செய்வோம். பெற்றோரிடம் செல்ல மறுத்தால் அக்குழந்தையை அரசு இல்லத்தில் சேர்ப்போம் அல்லது குழந்தை பெற்றோருடன் செல்வதாகச் சொன்னால், மாதம் ஒருமுறை குழந்தையை எங்கள் முன் ஆஜர்படுத்த வேண்டும் என்று ஆவணங்களில் எழுதி வாங்கிக்கொண்டு, அக்குழந்தையைக்  கண்காணித்து வருவோம். குழந்தைக்குத் தேவையான ஆலோசனைகளையும் வழங்குவோம். இந்தப் பணிகளைத் தொடர்ந்து செய்கிறோம். </p><p>மாவட்டத்தில் பல குழந்தைத் திருமணங்கள் நிறுத்தப்பட்டு, அவர்கள் இன்று நன்றாகப் படித்து வருகிறார்கள். மேலும், இதுபோல பாதிக்கப்பட்டு இல்லங்களில் தங்கி நன்றாகப் படித்து வரும் குழந்தைகளை எங்கள் மூலம் அறிந்துகொள்ளும் சில தனியார் அமைப்புகள், அவர்களுக்கு உதவி செய்து வருகிறார்கள். அதனால் பெரும்பாலும் விதி மீறிய திருமணங்களாலும், திருமணம் தடுக்கப்பட்டும் மீட்கப்படும் மாணவிகள் பாதுகாக்கப்பட்டு வருகிறார்கள். </p><p>தற்போது தற்கொலை செய்துகொண்ட மாணவியின் மரணம் பற்றி விசாரணை நடைபெற்று வருகிறது. மாவட்ட குழந்தைகள் நலக்குழுவும் விசாரணை நடத்துவோம்"" என்றார்.</p>",https://www.vikatan.com/social-affairs/crime/madurai-girl-dies-of-suicide-after-few-days-she-stopped-her-child-marriage,['https://gumlet.assettype.com/vikatan/2019-10/eb4fc57d-3f54-4c6f-ac09-40451ef661f8/68.jpg'],"Thu, 17 Jun 2021 13:02:12 +0000"
"""அய்யர்மலை ரோப்கார் பணி விரைவில் முழுமைக்கு வரும்!"" - அறநிலையத்துறை அமைச்சர் தகவல்","<p>கரூர் மாவட்டம், குளித்தலை ஒன்றியத்தில் இருக்கிறது அய்யர்மலை. இங்குள்ள இரத்தினகிரீஸ்வரர் கோயில் மிகவும் பிரசித்திபெற்றதாகும். பத்து வருடங்களுக்கு மேலாக இங்கு ஆமை வேகத்தில் ரோப்கார் அமைக்கும் பணி நடைபெற்று வந்தது. இந்த நிலையில், ""ரோப்கார் அமைக்கும் பணி விரைவில் முழுமையாக முடிவுக்கு வரும். ரோப்காரில் பக்தர்கள் மலை ஏறி, இரத்தினகிரீஸ்வரை தரிசிக்கலாம்"" என்று தமிழக இந்து சமய அறநிலையத்துறை அமைச்சர் பி.கே.சேகர்பாபு தெரிவித்துள்ளது, பக்தர்களை மகிழ்ச்சியில் ஆழ்த்தியிருக்கிறது.</p><figure><img src=""https://gumlet.assettype.com/vikatan/2021-06/99e5a4d7-799a-4aa1-b3e1-a1d38c9cc0a9/sekarbabu.jpg"" /><figcaption>பி.கே.சேகர்பாபு ஆய்வு </figcaption></figure><p>Also Read: <a href=""https://www.vikatan.com/news/tamilnadu/karur-new-collector-inspection-in-corona-ward"">கரூர்: `தைரியமாக இருங்க..!' - முதல்நாளிலேயே கவச உடை அணிந்து கொரோனா வார்டில் ஆய்வுசெய்த ஆட்சியர்</a></p><p>அய்யர்மலையில் உள்ள அருள்மிகு இரத்தினகிரீஸ்வரர் திருக்கோயில் இந்து அறநிலை துறையின் கீழ் நிர்வகிக்கப்பட்டு வருகிறது. காலை கடம்பர், மதியம் சொக்கர், அந்தி வேளையில் திருஈங்கோய்நாதர் என்பது இங்கு சொல்லப்படும் சிறப்பாகும். அதாவது, குளித்தலை கடம்பரை காலையிலும், அய்யர்மலை சொக்கரை மதியமும், மாலையில் முசிறி திருஈங்கோய்மலை நாதரையும் வழிபட்டால், காசிக்கு போனதற்குச் சமம் என்பர். அத்தகைய சிறப்பு வாய்ந்த சிறு மலைகுன்றின் மீது அமைந்துள்ள இந்தத் திருக்கோயிலை, 1117 படிக்கட்டுகளை ஏறி கடந்தால்தான் அடைய முடியும்.</p><figure><img src=""https://gumlet.assettype.com/vikatan/2021-06/d9ab04ec-9979-4725-8cd6-c6373e37ee8c/sekarbabu_2.jpg"" /><figcaption>பி.கே.சேகர்பாபு ஆய்வு </figcaption></figure><p>இந்த நிலையில், பக்தர்களின் சிரமத்தைப் போக்க, கடந்த 2006 - 2011 தி.மு.க ஆட்சியில் மலைக்கு ரோப்கார் அமைக்கும் பணி தொடங்கப்பட்டது. அதன்பிறகு, கடந்த பத்து வருடங்களுக்கு மேலாக இந்தப் பணி மெதுவாக நடந்து வந்தது. இந்த நிலையில்தான், தற்போதைய இந்து சமய அறநிலையத்துறை அமைச்சர் பி.கே.சேகர்பாபு, ரோப்கார் அமைக்கும் பணியை முடுக்கிவிட்டிருப்பது, பக்தர்களைப் பரசவத்தில் ஆழ்த்தியிருக்கிறது. நேற்று, இந்தக் கோயிலுக்கு வருகைதந்த அமைச்சர் பி.கே.சேகர்பாபு, நேரில் ஆய்வு செய்தார்.</p><p>பிறகு, செய்தியாளர்களை சந்தித்த அமைச்சர் சேகர்பாபு, </p><p>""அய்யர்மலை ரத்தினகிரீஸ்வரர் மலைக்கோயிலில் 1117 படிக்கட்டுகளைக் கடந்து மலை உச்சியில் பொதுமக்கள் தரிசனம் மேற்கொள்ள வேண்டும். இதற்காக, கடந்த 2010-ம் ஆண்டு தமிழக முன்னாள் முதலமைச்சர் கருணாநிதியால் ரோப்கார் அமைக்கும் திட்டம் அறிவிக்கப்பட்டது. அதன்பின்னர், 2017-ம் ஆண்டு டெண்டர் இறுதி செய்யப்பட்டு பணிகள் நடைபெற்றன. கடந்த ஜனவரி மாதம் மக்கள் பயன்பாட்டுக்காக ஒப்படைக்கப்பட்டது. இருந்தாலும், முழுமையான அளவு பணிகள் நிறைவேற்றப்படாமல் இருந்ததால், இதனை வயது முதிர்ந்தோர் பயன்படுத்த முடியாத நிலை உள்ளது. எனவே, இதனை கருத்தில் கொண்டு தமிழக மின்சாரத் துறை அமைச்சர் செந்தில் பாலாஜி மற்றும் குளித்தலை சட்டப்பேரவை உறுப்பினர் மாணிக்கம் ஆகியோர் மேற்பார்வையில், தனியார் பங்களிப்புடன் ரூ. 6.7 கோடி மதிப்பில் பணிகள் விறுவிறுப்பாக நடைபெற்று வருகின்றன.</p><figure><img src=""https://gumlet.assettype.com/vikatan/2021-06/2a717ae7-d162-4fb3-94d4-9f0ebbb78471/sekarbabu_inspection.jpg"" /><figcaption>பி.கே.சேகர்பாபு ஆய்வு </figcaption></figure><p>ஒவ்வொரு 15 நாள்களுக்கு ஒரு முறை இதனை பார்வையிட்டு பணிகளை வேகப்படுத்த தமிழக முதலமைச்சர் உத்தரவிட்டுள்ளார். அதனடிப்படையில், அறநிலைத்துறை ஆணையாளர் மற்றும் அமைச்சர் என்ற முறையில் நானும் இங்கு ஆய்வு செய்தேன். விரைவில் ரோப்கார் வசதி மக்கள் பயன்பாட்டிற்கு திறந்து வைக்கப்படும். அதேபோல், குளித்தலை மக்களின் நீண்ட நாள் கோரிக்கையான பேருந்து நிலையம் அமைக்கும் கோரிக்கையையும் நிறைவேற்ற இருக்கிறோம். தி.மு.க தலைவரும், முன்னாள் முதல்வருமான கலைஞர் முதன்முதலாக தேர்தலில் போட்டியிட்டு வெற்றி பெற்ற தொகுதி குளித்தலை தொகுதி. அதனால், இத்தொகுதியில் புதிதாக பேருந்து நிலையம் அமைக்க, கரூர் மாவட்ட ஆட்சித் தலைவர் அறநிலையத்துறை கீழ் உள்ள நிலத்தில் அமைப்பதற்கான கருத்துருவை தயார் செய்து அனுப்பினால், அது குறித்து விரைந்து நடவடிக்கை எடுத்து பொதுமக்களின் கோரிக்கையை நிறைவேற்ற அரசு தயாராக உள்ளது"" எனத் தெரிவித்தார்.</p>",https://www.vikatan.com/spiritual/news/tn-minister-pk-sekarbabu-inspection-in-kulithalai-ayyarmalai-temple,['https://gumlet.assettype.com/vikatan/2021-06/55489585-dfe1-422a-a1b1-b416d62510c8/robecar.jpg'],"Thu, 17 Jun 2021 12:23:29 +0000"
