title,text,link,image,pubdate
தமிழகத்தில் விரைவில் மாதாந்திர மின் கட்டண கணக்கீடு; மின் கட்டணம் குறையும் எப்படி?,"<p>தமிழக மின்சாரத் துறை அமைச்சர் செந்தில் பாலாஜி, தமிழகத்தில் மாதாந்திர மின்கட்டண கணக்கீடு முறை விரைவில் அறிமுகப்படுத்தப்படும் என்று தெரிவித்தார். இதன் மூலம், வீட்டு மின் கட்டணம் குறைவாக செலுத்தும் நிலை ஏற்படும் மின்கட்டணம் குறையும் என்று கூறப்படுகிறது.</p>



<p>மாதாந்திர மின் கட்டண கணக்கீடு செய்யப்படுவதால் எப்படி மின் கட்டணம் குறையும் என்று கேள்விகள் எழுந்துள்ளன.</p>



<p><strong>தமிழகத்தில் மாதாந்திர மின் கட்டண முறை அமல்படுத்தப்பட்டால் எப்படி மின் கட்டணம் குறையும்?</strong></p>



<p>தமிழ்நாட்டில் வீட்டு உபயோகத்திற்கான மின்சார கட்டணம் தற்போது 2 மாதங்களுக்கு ஒருமுறை கணக்கெடுக்கப்பட்டு மின் கட்டணம் வசூல் செய்யப்பட்டு வருகிறது.</p>



<p>தமிழக அரசின் அறிவிப்புபடி, வீட்டு மன் உபயோகத்திற்கு முதல் 100 யூனிட்டுகள் இலவசம் அதற்கு மேல் பயன்படுத்தினால் அதற்கான கட்டணம் டெலஸ்கோபிக் டாரிஃப் என்ற மின் கட்டண முறையில் கணக்கிடப்படுகிறது.</p>



<p>ஒருவர் 200 யூனிட்டுகள் பயன்படுத்தினால், முதல் 100 யூனிட்டுகள் இலவசம் அதற்கு மேல் உள்ள 101-200 யூனிட்டுகளுக்கு ஒரு யூனிட்டின் விலை ரூ.1.5 என்ற வீதத்தில் ரூ.150 அத்துடன் நிலையான கட்டணம் ரூ.20 சேர்த்து மொத்தமாக ரூ.170 வசூல் செய்யப்பட்டு வருகிறது.</p>



<p>இதுவே, ஒருவர் வீட்டில் 520 யூனிட்டுகள் உபயோகித்தால், முதல் 100 யுனிட்டுகள் இலவசம் அதற்கு மேல் 101-200 யூனிட்டுகளுக்கு ஒரு யூனிட்டின் விலை ரூ.1.5க்கு பதிலாக ரூ.3.50ஆக அதிகரிக்கும். அப்படிப்பார்த்தால் 101-200 யூனிட்டுகளுக்கு ரூ.350 என்று கணக்கில் கொள்ளப்படும். 201-500 யூனிட்டுகளுக்கு ஒரு யூனிட்டின் விலை ரூ.4.60 என்ற வீதத்தில் ரூ.1,380 வசூலிக்கப்படும். 500-520 யூனிட்டுகள் வரை ஒவ்வொரு யூனிட்டின் விலை ரூ.6.60 என்ற வீதத்தில் ரூ.132 மற்றும் நிலையான கட்டணம் ரூ.20 உடன்என்று மொத்தமாக ரூ.1,912 கட்டணமாக வசூலிக்கப்படும்.<br />தமிழக அரசின் இந்த மின்கட்டண முறையால் நடுத்தர மக்கள் அதிக கட்டணம் செலுத்த வேண்டியுள்ளது. இதனால், பொருளாதார நெருக்கடிக்கு உள்ளாகிறார்கள். மின்சார பயன்பாட்டை கணக்கிடுவதில் நடக்கும் குழப்பங்களாலும் பொது மக்கள் பாதிக்கப்படுகின்றனர். மேலும், இந்த மின் கட்டண முறை மக்களுக்கு மிகவும் குழப்பமானதாகவும் உள்ளது. அதோடு, உரிய நேரத்தில் மின் கட்டணம் கணக்கெடுக்க முடியாமல் தாமதமாகும் சூழ்நிலையும் உள்ளது.</p>



<p>இதைவிட முக்கியமானது 2 மாதங்களுக்கு ஒரு முறை மின் கட்டணம் கணக்கிடப்படுவதால் மின் உபயோகம் அதிகரிக்கும். இதனால், டெலஸ்கோபிக் டாரிஃப் முறைப்படி அதிக மின் கட்டணம் செலுத்த நேரிடுகிறது.</p>



<p>ஒருவர் 2 மாதத்திற்கு ஒரு முறை மின் கணக்கீட்டு முறையில், முதல் 100 யூனிட்டுகள் போக முதல் மாதத்தில் 200 யூனிட்டு பயன்படுத்துகிறார் என்றால், 2வது மாதம் முடிவடையும்போது 400 யூனிட்டுகளை பயன்படுத்துகிறார் என்றால் அப்போது மின் கட்டணம் அதிகமாகும். இதுவே மாதம் ஒருமுறை மின்கட்டணம் செலுத்தினால் மின் கட்டணம் குறைவாக வரும்.</p>



<p>அதனா, பொதுமக்கள் தமிழக அரசு மாதம் ஒரு முறை மின் கட்டணம் கணக்கிடும் முறையைக் கொண்டுவர வேண்டும். அல்லது மின்சாரக் கட்டணத்தை குறைக்க வேண்டும் என்று கோரிக்கை வைத்தனர். இந்த சூழலில்தான், திமுக தனது தேர்தல் அறிக்கையில், தமிழகத்தில் மாதாந்திர மின்கட்டண முறை அமல்படுத்தப்படும் என்று உறுதி அளித்திருந்தது. அதன்படி, தமிழகத்தில் மாதாந்திர மின்கட்டண கணக்கீடு விரைவில் அறிமுகப்படுத்தப்படும் என்று மின்சாரத்துறை அமைச்சர் செந்தில்பாலாஜி தெரிவித்துள்ளார்.</p>



<p>தமிழகத்தில் மாதாந்திர மின் கட்டணமுறை அறிமுகப்படுத்தப்பட்டால், வீட்டு மின் உபயோக நுகர்வோர்கள் வெகுவாக மின் கட்டணத்தைக் குறைத்து செலுத்த நேரிடும் என்பதில் ஐயமில்லை. அதனால், மின் நுகர்வோர் மகிழ்ச்சியில் உள்ளனர்.</p>



<p>&#8220;தமிழ் இந்தியன் எக்ஸ்பிரஸின் அனைத்து செய்திகளையும் உடனுக்குடன் டெலிகிராம் ஆப்பில் பெற <a href=""https://t.me/ietamil"" rel=""noreferrer noopener"" target=""_blank"">https://t.me/ietamil</a></p>",https://tamil.indianexpress.com/tamilnadu/minister-senthil-balaji-says-monthly-electricity-bill-calculation-will-be-introduced-soon-304667/,['https://tamil.indianexpress.com/wp-content/uploads/2021/05/eb-meter.jpg'],"Tue, 18 May 2021 22:47:59 +0530"
ஆபாச மெசேஜ் அனுப்பிய பேராசிரியர்; பொதுவில் அம்பலப்படுத்தி பாடம் புகட்டிய நடிகை!,"<p>சீரியல் நடிகையும் பாடகியுமான சௌந்தர்யா தனக்கு கல்லூரி பேராசிரியர் ஒருவர் ஆபாசமாக மெசேஜ் அனுப்பியதை பொதுவெளியில் அம்பலப்படுத்தி அவருக்கு பாடம் புகட்டியுள்ளார்.</p>



<p>விஜய் டிவியில் ஒளிபரப்பான சூப்பர் சிங்கர் நிகழ்ச்சி மூலம் பிரபலமானவர் சௌந்தர்யா. இதையடுத்து அவர் தற்போது சீரியல்களிலும் திரைப்படங்களிலும் நடித்துவருகிறார்.</p>



<p>நடிகை சௌந்தர்யாவுக்கு கடந்த சில தினங்களாக மர்ம நபர் ஒருவர் ஆபாசமாக மெசேஜ் அனுப்பி வந்துள்ளார். அந்த நபர் ஒரு கல்லூரி பேராசிரியர் என்பது தெரியவந்துள்ளது. இதையடுத்து நடிகை சௌந்தர்யா அந்த நபரை பொதுவெளியில் அம்பலப்படுத்தி பாடம் புகட்டியுள்ளார்.</p>



<figure class=""wp-block-image size-large""><img alt="""" class=""wp-image-304653"" height=""675"" src=""https://tamil.indianexpress.com/wp-content/uploads/2021/05/Actress-_Soundarya_-_2.jpg?w=1024"" width=""1200"" /></figure>



<p>இதுகுறித்து சௌந்தர்யா தன்னுடைய இன்ஸ்டாகிராம் பக்கத்தில் குறிப்பிட்டுள்ளதாவது, “இதுதான் ஒரு பேராசிரியர் பெண்களிடம் பேசும் முறையா? மிகவும் கேவலமாக உள்ளது. இவர் மதுரையில் பணியாற்றுவதாக அவர் இன்ஸ்டாகிராம் கணக்கு கூறுகிறது. இவரைச் சுற்றியுள்ள கல்லூரி மாணவிகள் பாதுகாப்பாக இருப்பார்கள் என்று நம்புகிறேன். இவர் யார் என்பதை கண்டறிந்து, உரிய முறையில் இவர்மீது புகாரளிப்பேன். இவர் தற்போது என்னை ப்ளாக் செய்துவிட்டார். இருப்பினும், அவர் வேலை பார்க்கும் கல்லூரி நிர்வாகத்திற்கு எச்சரிக்கை கொடுக்க போதுமான விவரங்கள் என்னிடம் உள்ளன. பொறுப்பான இடத்தில் இருந்துகொண்டு பெண்களிடம் இவ்வாறு பேசியது எவ்வளவு பெரிய தவறு என்பதை அவர் உணர்வதற்கு நான் முயற்சிகள் எடுப்பேன். அவர் நிச்சயம் இதற்கான தண்டனையை அனுபவிப்பார்” என்று குறிப்பிட்டுள்ளார்.</p>



<p>நடிகை சௌந்தர்யா தனக்கு ஆபாசமாக மேசேஜ் அனுப்பிய கல்லூரி பேராசிரியரை துணிச்சலாக பொதுவெளியில் அம்பலப்படுத்தி அவருக்கு பாடம் புகட்டியுள்ளார்.</p>



<p><strong>&#8220;தமிழ் இந்தியன் எக்ஸ்பிரஸின் அனைத்து செய்திகளையும் உடனுக்குடன் டெலிகிராம் ஆப்பில் பெற&nbsp;<a href=""https://t.me/ietamil"" rel=""noreferrer noopener"" target=""_blank"">https://t.me/ietamil</a>&#8220;</strong></p>",https://tamil.indianexpress.com/entertainment/actress-and-singer-soundarya-exposes-college-lecturer-who-sent-inappropriate-messages-304649/,['https://tamil.indianexpress.com/wp-content/uploads/2021/05/New-Project-2021-05-18T210155.878.jpg'],"Tue, 18 May 2021 21:21:12 +0530"
உயிர் பயத்தை காசாக்கும் தனியார் ஆம்புலன்ஸ்.. அதிர வைக்கும் பேரம்..!,"ஏழை மக்கள் பாதிக்கப்படக்கூடாது என்பதற்காக அண்மையில் தனியார் ஆம்புலன்ஸ்களுக்கு தமிழக அரசு கட்டணம் நிர்ணயம் செய்து உத்தரவிட்டது. ஆனால் சென்னையில் அரசு நிர்ணயித்துள்ள கட்டணத்தை விட மூன்று மடங்கு அதிக கட்டணத்தை தனியார் ஆம்புலன்ஸ்கள் வசூலிப்பதாக புகார் எழுந்துள்ளது. உயிர் போகும் நேரத்திலும் காசுக்காக பேரம் பேசும் அவலம் குறித்து விவரிக்கிறது இந்த செய்தித்தொகுப்பு...
தமிழகத்தில் கொரோனா தொற்று அதிகரித்து வருவதால் ஆம்புலன்ஸ்களின் தேவை அதிகமாகி உள்ளது. மருத்துவமனைகளில் படுக்கைகள் கிடைக்காததால், பலருக்கு ஆம்புலன்ஸிலேயே சிகிச்சை அளிக்கப்படும் சூழலும் உருவாகியுள்ளது. பல இடங்களில் மருத்துவமனைகள் முன் ஆம்புலன்ஸ்கள் வரிசை கட்டி நிற்பதால், அவசர தேவைக்கு ஆம்புலன்ஸ்களுக்கு தட்டுப்பாடு நிலவுகிறது. இதனை பயன்படுத்தி தனியார் ஆம்புலன்ஸுக்கு கூடுதல் கட்டணம் வசூலிப்பதாக புகார் எழுந்தது. இதனால் மக்கள் பாதிக்கப்படக்கூடாது என தனியார் ஆம்புலன்ஸ்களுக்கான கட்டணத்தை தமிழக அரசு முறைப்படுத்தி உத்தரவிட்டது. அதன்படி சாதாரண தனியார் ஆம்புலன்ஸ் வாகனங்கள் 10 கிலோ மீட்டருக்கு 1500 ரூபாயும், ஆக்சிஜன் வசதியுடன் கூடிய தனியார் ஆம்புலன்ஸ் வாகனங்கள் முதல் 10 கிலோ மீட்டருக்கு 2,000 ரூபாயும் வென்டிலேட்டர் வசதிகளுடன்கூடிய தனியார் ஆம்புலன்ஸ் வாகனங்கள் முதல் 10 கிலோ மீட்டருக்கு 4 ஆயிரம் ரூபாயும் வசூல் செய்ய உத்தரவிடப்பட்டிருந்தது.
இதற்கு பிறகும் கூட, சென்னையில் சில தனியார் ஆம்புலன்ஸ் வாகனங்களின் ஒட்டுநர்கள், பேராசையின் மிகுதியில் மூன்று மடங்கு அதிகம் கட்டணம் வசூலிப்பதாக புகார் எழுந்துள்ளது. உயிருக்கு போராடும் தனது உறவினரை எப்படியாவது காப்பாற்றிட வேண்டும் என போராடிக் கொண்டிருப்பவர்களை பலியாடாக நினைத்து தனியார் ஆம்புலன்ஸ் ஓட்டுநர்கள் இஸ்டத்துக்கு கட்டணம் வசூலிக்கின்றனர்.
முதலில், தற்போது ஆம்புலன்ஸ் எதுவும் ஃபிரி (Free) ஆக இல்லை எனக்கூறும் ஓட்டுநர்கள், எவ்வளவு செலவானாலும் பரவாயில்லை மருத்துவமனைக்கு உடனடியாக கொண்டு செல்லவேண்டும் என பதறும் நோயாளியின் உறவினர்களிடம், இவ்வளவு பணம் கொடுத்தால் வருகிறோம் என பேரம் பேசும் அலவமும் அரங்கேறுகிறது.
ஆக்சிஜன் இல்லாத சாதாரண தனியார் ஆம்புலன்ஸ் வாகனத்திற்கே மீனம்பாக்கத்தில் இருந்து ராஜீவ்காந்தி அரசு மருத்துவமனை செல்ல 6,500 ரூபாய் வரை வசூலிக்கப்படுவதாக புகார் உள்ளது. மீனம்பாக்கத்திலிருந்து ராஜீவ் காந்தி அரசு மருத்துவமனைக்கு 15 கிலோ மீட்டர் ஆகும். சாதாரண ஆம்புலன்ஸ்களுக்கு 10 கிலோ மீட்டருக்கு 1,500 ரூபாய் மட்டுமே அரசால் கட்டணமாக நிர்ணயிக்கப்பட்டுள்ளது. எப்படி பார்த்தாலும் மீனம்பாக்கத்திலிருந்து ராஜீவ் காந்தி மருத்துவமனைக்கு செல்ல 2500ரூபாய்க்கு மேல் கட்டணம் வராது. ஆனால், அவசரத்தை பயன்படுத்தி அநியாயமாக 6500 ரூபாய் வரை தனியார் ஆம்புலன்ஸ் மூலம் வசூலிக்கிறார்கள்.
அதே தொலைவுக்கு ஆக்சிஜன் வசதி கொண்ட ஆம்புலன்ஸ் ஆக இருந்தால் 9 ஆயிரம் வரை பேரம் பேசுகிறார்கள்.
பத்து கிலோ மீட்டருக்கும் குறைவான தொலைவு மட்டுமே கொண்ட தியாகராயர் நகரில் இருந்து ராஜீவ் காந்தி அரசு மருத்துவமனை செல்ல ஆக்சிஜன் இல்லாத தனியார் ஆம்புலன்ஸ் ஆக இருந்தால் 2,800 ரூபாயும் ஆக்சிஜன் வசதி கொண்ட தனியார் ஆம்புலன்ஸ் ஆக இருந்தால் 5 ஆயிரம் வரையும் வசூலிக்கப்படுகிறது.
உயிரைக் கையில் பிடித்துக் கொண்டு மூச்சு விடவே சிரமப்பட்டுக் கொண்டிருக்கும் கொரோனா நோயாளிகளின் அவசரத்தை பயன்படுத்தி கொள்ளை லாபம் பார்க்கும் தனியார் ஆம்புலன்ஸ் நிறுவனங்களின் வசூல் வேட்டைகளை அதிகாரிகள் தடுக்க வேண்டும் என கோரிக்கை எழுந்துள்ளது..",https://www.polimernews.com/view/146497-உயிர்-பயத்தை-காசாக்கும்-தனியார்-ஆம்புலன்ஸ்..-அதிர-வைக்கும்-பேரம்..!,['http://img.polimernews.com/uploads/web/images/original/1621352874146497.jpg'],"Tue, 18 May 2021 20:58:50 +0530"
