title,text,link,image,pubdate
"கரூர்:`ஆடுகளைக் கொன்னு, ஆத்திரத்தைத் தீர்த்துக்கிட்டேன்!’ - முன்விரோதத்தில் உறவினரின் வெறிச்செயல்","<p>கரூர் அருகே முன்விரோதம் காரணமாக, தனது எதிரிக்குச் சொந்தமான நான்கு ஆடுகளை கொன்று, கல் குவாரி குட்டையில் வீசிய ஆசாமியின் செயல், அந்தப் பகுதி மக்களை அதிர்ச்சியடைய வைத்திருக்கிறது.</p><figure><img src=""https://gumlet.assettype.com/vikatan/2021-07/001e4e54-e021-4d0d-8399-0e63e6a16f4c/krishnarayapuram.jpg"" /><figcaption>கிருஷ்ணராயபுரம்</figcaption></figure><p>Also Read: <a href=""https://www.vikatan.com/news/controversy/senthil-balaji-faced-controversy-in-shop-opening-issue"">`அண்ணனைக் கோத்துவிட்டார்கள்!’ - கரூரில் விதிமுறைகளை மீறிக் கடைகள் திறப்பு சர்ச்சை</a></p><p>கரூர் மாவட்டம், கிருஷ்ணராயபுரம் ஒன்றியத்திலுள்ள கீழடை மாணிக்கபுரத்தைச் சேர்ந்தவர் சுப்பிரமணி. விவசாயியான இவர், தனக்குச் சொந்தமான நிலத்தில் விவசாயம் செய்துவருகிறார். அதோடு, சுப்பிரமணி தனக்குச் சொந்தமான 15-க்கும் மேற்பட்ட ஆடுகளையும் வளர்த்துவந்திருக்கிறார். அந்த ஆடுகளை தினமும் அந்தப் பகுதியிலுள்ள கல்குவாரிக்கு அருகில் பகல் முழுவதும் மேய்ப்பதை வாடிக்கையாக வைத்திருக்கிறார். பின்னர், மாலையில் ஆடுகளை ஓட்டிவந்து பட்டியில் அடைப்பார். இந்தநிலையில், சுப்பிரமணி வழக்கம்போல மேய்ச்சலுக்குச் சென்ற ஆடுகளை ஓட்டி வந்து பட்டியில் அடைக்கும்போது, நான்கு ஆடுகள் குறைவாக இருப்பதைக் கண்டு அதிர்ச்சி அடைந்தார். யாரேனும் ஆடுகளை திருடிக்கொண்டு சென்றுவிட்டார்களா என்ற பதைபதைப்புடன் ஆடுகள் மேய்ந்த கல்குவாரிக்கு ஓடிச் சென்றிருக்கிறார்.  கல்குவாரி பகுதியில் தேடிப் பார்த்தபோது, கல்குவாரி குட்டையில் தேங்கியிருந்த தண்ணீரில் அவருக்குச் சொந்தமான நான்கு வெள்ளாடுகளும் உயிரிழந்த நிலையில் மிதந்து கொண்டிருந்ததைப் பார்த்ததும் அதிர்ந்துபோனார். உடனே, ஆடுகளின் உடல்களை மீட்ட சுப்பிரமணி, இதற்குக் காரணமானவர்கள் யார் என விசாரித்திருக்கிறார்.</p><figure><img src=""https://gumlet.assettype.com/vikatan/2021-07/a7c53a51-2b77-497b-9104-8f67cec7eceb/mayanur_police_station.jpg"" /><figcaption>மாயனூர் காவல் நிலையம்</figcaption></figure><p>அப்போது, இவரது உறவினரான பெருமாள் என்பவர் கல்குவாரி பகுதிக்கு வந்து சென்றது தெரிய வந்துள்ளது. இதையடுத்து, மாயனூர் காவல் நிலையத்தில் சுப்பிரமணி புகார் அளித்தார். மாயனூர் காவல் நிலைய போலீஸார் மேற்கொண்ட விசாரணையில், பெருமாள்தான் முன்விரோதம் காரணமாக சுப்பிரமணியின் ஆடுகளைக் கொன்று கல்குவாரியில் வீசியது தெரியவந்தது. அதோடு, `எனக்கும், சுப்பிரமணியனுக்கும் ஆகாது. ஏக குடைச்சல் கொடுத்தான். அவனை எதாவது செய்ய எனக்கு தைரியம் இல்லை. அதனால்தான், அவன் வளர்த்து வந்த ஆடுகளைக் கொன்னு, என்னோட ஆத்திரத்தை தீர்த்துக்கிட்டேன்' என்று காவல்துறையினரிடம் கூறி, அதிரவைத்துள்ளார். இதையடுத்து, மாயனூர் காவல் நிலைய போலீஸார் பெருமாளைக் கைதுசெய்து, விசாரணை மேற்கொண்டுவருகின்றனர். முன்விரோதம் காரணமாக சுப்பிரமணி வளர்த்து வந்த ஆடுகளை பெருமாள் கொடூரமாக கொலை செய்த விவகாரம், அந்தப் பகுதியில் பரபரப்பை ஏற்படுத்தியிருக்கிறது.</p>",https://www.vikatan.com/news/crime/karur-man-killed-four-goats-in-family-issue,['https://gumlet.assettype.com/vikatan/2021-07/7855a0cd-94c7-4350-af62-348b8ddbd27f/WhatsApp_Image_2021_07_02_at_09_55_00.jpeg'],"Fri, 02 Jul 2021 04:20:42 +0000"
தமிழ்நாடு சட்டமன்ற தேர்தலுக்கு இத்தனை கோடி ரூபாய் செலவா..? அரசாணை வெளியீட்டில் தகவல்..!,"தமிழ்நாடு சட்டமன்ற தேர்தலை நடத்த ரூ.744 கோடி செலவிடப்பட்டுள்ளதாக அரசாணை வெளியிடப்பட்டுள்ளது.  தமிழகத்தில் கடந்த ஏப்ரல் மாதம் 6ம் தேதி ஒரே கட்டமாக சட்டமன்றத் தேர்தல் நடத்தி முடிக்கப்பட்டது. இதற்கான ஓட்டு எண்ணிக்கை மே 2ம் தேதி நடைபெற்றது. அதில், திமுக தனிப்பெரும்பான்மை பெற்று ஆட்சியை கைப்பற்றியது. கோவிட் தொற்று பரவல் நேரத்தில் தேர்தல் நடத்தபட்டதால், தொற்று பரவலை கட்டுப்படுத்தும் பல்வேறு நடவடிக்கைகளுடன், ஓட்டுப்பதிவு, ஓட்டு எண்ணிக்கை நடைபெற்றது. ஓட்டுப்பதிவு மையத்தை தயார் செய்வது, ஓட்டு எண்ணிக்கை, பயணங்கள், அலுவலக செலவுகள், அதிகாரிகள் மற்றும் அலுவலர்களுக்கான ஊதியம் என தேர்தல் பணிகளுக்கு பல கோடி ரூபாய் செலவானது.  கோவிட் பரிசோதனை, கிருமி நாசினி, வாக்காளர்களுக்கு கை கிளவுஸ் போன்றவைகளும் வழங்கப்பட்டன. இந்த நிலையில், தமிழக சட்டசபைத் தேர்தலுக்கு ரூ.744 கோடி செலவிடப்பட்டதாக அரசாணை வெளியிடப்பட்டுள்ளது. அதில், தேர்தலுக்கு ரூ.618 கோடியும், தொலைபேசி, எரிபொருள், வாடகை வாகனம், விளம்பரம் உள்ளிட்ட செலவினமாக ரூ.126 கோடியும் செலவிடப்பட்டதாகக் குறிப்பிடப்பட்டுள்ளது. &nbsp;",https://tamil.asianetnews.com/politics/how-many-crores-of-rupees-will-be-spent-for-the-tamil-nadu-assembly-election-government-release-information--qvm5tt,['https://static.asianetnews.com/images/01f1m11rvj7vxy5ndaaanynz5t/ghghg-jpg_760x400.jpg'],"Fri, 02 Jul 2021 04:14:17 +0530"
#ENGvsSL நான் கேப்டனா இருந்திருந்தா அந்த 3 வீரர்களுக்கும் 2-3 அறையை போட்ருப்பேன்..! ரணதுங்கா கடுங்கோபம்,"1996ல் ரணதுங்கா கேப்டன்சியில் உலக கோப்பையை வென்ற இலங்கை அணி, அடுத்த 15 ஆண்டுகள் சர்வதேச கிரிக்கெட்டில் கோலோச்சியது. ஜெயசூர்யா, முரளிதரன், அட்டப்பட்டு, சமிந்தா வாஸ், சங்கக்கரா, ஜெயவர்தனே, மலிங்கா என பல தலைசிறந்த வீரர்களுடன் சர்வதேச கிரிக்கெட்டில் ஆதிக்கம் செலுத்திய இலங்கை அணி, 2007 மற்றும் 2011 ஒருநாள் உலக கோப்பைகளில் ஃபைனல் வரை சென்று ஃபைனலில் தோற்று கோப்பையை இழந்தது.  மிகச்சிறந்த டாப் அணியாக திகழ்ந்த இலங்கை அணி, அண்மைக்காலமாக ச ர்வதேச கிரிக்கெட் அரங்கில் ஒரு அணியாகவே மதிக்கப்படுவதில்லை. அந்தளவிற்கு படுமோசமாக ஆடிவருகிறது.  இங்கிலாந்துக்கு சுற்றுப்பயணம் சென்றுள்ள இலங்கை அணி, டி20 தொடரில் ஒயிட்வாஷ் ஆனது. அதைத்தொடர்ந்து நடந்த ஒருநாள் தொடரின் முதல் 2 போட்டிகளிலும் தோற்று தொடரை இழந்தது. இந்த படுதோல்விகளுக்கு அந்த அணியின் முக்கியமான 3 வீரர்கள் ஆடாததும் காரணம். அவர்கள் ஆடமுடியாமல் போனதற்கு அவர்களே காரணம்.  கிரிக்கெட் போட்டிகள் அனைத்தும் கொரோனா பாதுகாப்பு வழிகாட்டு நெறிமுறைகளை பின்பற்றியே நடத்தப்படுகிறது. வீரர்கள் அனைவரும் இந்த நெறிமுறைகளை பின்பற்றி நடக்க வேண்டும். ஆனால் குசால் மெண்டிஸ், தனுஷா குணதிலகா மற்றும் டிக்வெல்லா ஆகிய இலங்கை அணியின் 3 முக்கியமான வீரர்களும் கொரோனா விதிகளை மீறி வெளியே சுற்றியதன் விளைவாக, இங்கிலாந்துக்கு எதிரான தொடரிலிருந்து நீக்கப்பட்டு, இலங்கைக்கு திருப்பியனுப்பப்பட்டனர்.  இந்த வீரர்களின் பொறுப்பற்ற செயல், இலங்கை கிரிக்கெட் வாரியம், முன்னாள் வீரர்கள், ரசிகர்கள் என அனைத்து தரப்பினருக்கும் அதிருப்தியை ஏற்படுத்தியது.&nbsp;  அந்தவகையில், இதுகுறித்து கருத்து தெரிவித்துள்ள இலங்கை அணியின் உலக கோப்பை(1996) வின்னிங் கேப்டன் ரணதுங்கா, வீரர்கள் சமூக வலைதளங்களை பயன்படுத்துவதற்கே நான் அனுமதிக்கமாட்டேன். ஃபேஸ்புக், இன்ஸ்டாகிராம் ஆகியவற்றில் மூழ்கியிருக்கிறார்கள் கிரிக்கெட் வீரர்கள். சொல்லப்போனால் கிரிக்கெட் ஆடுவதை தவிர மற்ற அனைத்து வேலைகளையும் செய்கின்றனர். இலங்கை அணி நிர்வாகம் இதையெல்லாம் கண்டுகொள்வதேயில்லை. நான் கேப்டனாக இருந்திருந்தால், இவர்கள் எல்லாம் எப்பேர்ப்பட்ட வீரர்களாக இருந்தாலும் சரி, 2-3 அறைகளை போட்டிருப்பேன் என்று கடுங்கோபத்துடன் பேசியுள்ளார் ரணதுங்கா. &nbsp;",https://tamil.asianetnews.com/sports-cricket/arjuna-ranatunga-would-have-slapped-those-3-sri-lankan-cricketers-who-breached-bio-bubble-qvm5ou,['http://static.asianetnews.com/images/d76e30e7-49d7-49cf-a084-4affc5432664/image_760x400.jpg'],"Fri, 02 Jul 2021 04:11:19 +0530"
ஒரு மாவட்டம் கூட இப்படி இருக்க கூடாது... முதல் கூட்டத்திலேயே முதல்வர் கொடுத்த மிகப்பெரிய டார்க்கெட்..!,"தமிழகத்தில் கொரோனா 2வது அலையின் தாக்கம் சற்றே குறைய ஆரம்பித்ததை அடுத்து, முதலமைச்சர் மு.க.ஸ்டாலின் தமிழகத்தின் வளர்ச்சிப் பணிகளில் தீவிர கவனம் செலுத்தி வருகிறார். துறை ரீதியாக மேற்கொள்ளப்பட வேண்டிய நடவடிக்கைகள், திட்டங்கள் குறித்து சம்பந்தப்பட்ட அமைச்சர்கள் மற்றும் உயர் அதிகாரிகளுடன் ஆய்வு கூட்டங்களை நடத்தி வருகிறார்.&nbsp;இன்று தலைமைச் செயலகத்தில் முதலமைச்சர் மு.க.ஸ்டாலின் தலைமையில், மாநில வளர்ச்சிக் கொள்கைக் குழுவின் முதல் கூட்டம் நடைபெற்றது.    இதில் நிதி மற்றும் மனிதவள மேலாண்மைத் துறை அமைச்சர் பழனிவேல் தியாகராஜன், தலைமைச் செயலாளர் முனைவர் இறையன்பு, வளர்ச்சிக் கொள்கைக் குழுவின் துணைத் தலைவர் பேராசிரியர் ஜெயரஞ்சன். சட்டமன்ற உறுப்பினர் திரு. டி.ஆர்.பி.இராஜா, திட்டம் மற்றும் வளர்ச்சித் துறை கூடுதல் தலைமைச் செயலாளர் &nbsp;விக்ரம் கபூர், நிதித் துறை கூடுதல் தலைமைச் செயலாளர் கிருஷ்ணன் உள்ளிட்டோர் பங்கேற்றனர்.&nbsp;  இக்கூட்டத்தில், மு.க. ஸ்டாலின் உரையாற்றியதாவது: தமிழ்நாட்டின் அனைத்துப் பகுதிகளும் ஒரே சீரான மேம்பாடு அடைந்த பகுதிகளாக மாறவேண்டும் என்றும், பின்தங்கிய சமூகம், பின்தங்கிய மக்கள் என்று யாரும் இருக்கக்கூடாது என்ற வகையில் ஐந்து ஆண்டுகள், பத்து ஆண்டுகள் ஆனாலும் கரையாத, நிலையான வளர்ச்சியை தமிழ்நாடு அடையவேண்டும் என்றும் அதற்கான திட்டமிடுதல்கள் ஒவ்வொரு துறையிலும் தேவை என்றும் குறிப்பிட்டார்.&nbsp;    மேலும், பொருளாதார வளர்ச்சியும், சமூக நலத் திட்டங்களும் ஒன்றுக்கொன்று கைகொடுத்து செயல்பட்டதால் தான், தமிழ்நாடு வளர்ச்சி அடைந்தது என நோபல் பரிசு பெற்ற பொருளாதார மேதை அமர்த்தியா சென் &nbsp;பாராட்டியதை முதலமைச்சர் சுட்டிக்காட்டினார். &nbsp;    'தமிழ்நாட்டின் வளர்ச்சி என்பது ஏற்றுமதி, இறக்குமதி மட்டும் அல்ல - நிதி மூலதனம் அல்ல - வளர்ச்சி என்பது அனைத்துத் தரப்பு மக்களின் வளர்ச்சியாக இருக்க வேண்டும். மாநில வளர்ச்சிக் கொள்கைக் குழு, தமிழ்நாடு அரசு செல்ல வேண்டிய பாதைக்கு வழிகாட்டும் கலங்கரை விளக்கமாகத் திகழவேண்டும்’ என்றும், மாநிலத்தின் வளர்ச்சிக்கான நல்வழியினைக் காட்ட வேண்டுமென்றும் தெரிவித்தார். இதற்கு முன்னதாக மாநில வளர்ச்சிக் கொள்கைக் குழுவின் துணைத் தலைவர் ஜெயரஞ்சன், இந்தக் குழுவின் செயல்பாடுகள் குறித்தும், பல்வேறு திட்டங்கள் குறித்தும் விரிவாக எடுத்துரைத்தது குறிப்பிடத்தக்கது.",https://tamil.asianetnews.com/politics/chief-minister-mk-stalin-chaired-meeting-with-planning-commission-and-minister-qvm55c,['https://static.asianetnews.com/images/01f6c4gydjrpdxrtrmyq9sk7tn/-ogubydp-jpg_760x400.jpg'],"Fri, 02 Jul 2021 03:59:37 +0530"
அடச்சீ கருமம் கருமம்.. பெற்ற மகளை 2 வருடங்களாக மிரட்டி பலாத்காரம் செய்து கர்ப்பமாக்கிய காமக்கொடூர தந்தை..!,"பெற்ற மகளை 2 வருடங்களாக மிரட்டி பலாத்காரம் செய்து கர்ப்பமாக்கிய காம கொடூர தந்தையை போலீசார் போக்சோவில் கைது செய்து சிறையில் அடைத்தனர்.&nbsp;  சோழிங்கநல்லூர் கிராம நெடுஞ்சாலை பகுதியை சேர்ந்த 14 வயது சிறுமி, சோழிங்கநல்லூர் அரசு மேல்நிலைப்பள்ளியில் 10ம் வகுப்பு படித்து வருகிறாள். அந்த சிறுமிக்கு திடீரென உடல்நலக்குறைவு ஏற்பட்டது. இதனையடுத்து, கேளம்பாக்கத்தில் உள்ள தனியார் மருத்துவமனையில் சிகிச்சைக்காக அனுமதிக்கப்பட்டார்.    அப்போது அவரை பரிசோதித்த மருத்துவர்கள், சிறுமி 6 மாதம் கர்ப்பமாக இருப்பதாக கூறினார். இதைகேட்ட, தாய் அதிர்ச்சியடைந்தார். உடனே இது தொடர்பாக&nbsp;கிண்டி அனைத்து மகளிர் காவல் நிலையத்தில் புகார் அளித்தார். இதனையடுத்து, போலீசார் வழக்குப்பதிவு செய்து சிறுமியிடம் விசாரணை நடத்தினர். அதில், தனது கர்ப்பத்திற்கு காரணம் தந்தை வர்க்கீஸ்(54) எனவும், கடந்த 2 வருடங்களாக வீட்டில் தாள் இல்லாத நேரத்தில் &nbsp;தன்னிடம் பாலியல் பலாத்காரத்தில் ஈடுபட்டதாகவும், இது தொடர்பாக வெளியே சொன்னால் கொலை செய்துவிடுவதாகவும் மிரட்டிதாக &nbsp;கூறியுள்ளார்.    இதனை கேட்டு அதிர்ச்சியடைந்த போலீசார் சிறுமியின் தந்தை வர்கீஸை போக்சோ சட்டத்தில் போலீசார் கைது செய்து சிறையில் அடைத்தனர். மகளையே தந்தை பலாத்காரம் செய்து கர்ப்பமாக்கிய சம்பவம் அப்பகுதியில் அதிர்ச்சியை ஏற்படுத்தியுள்ளது.&nbsp;",https://tamil.asianetnews.com/crime/father-who-raped-his-daughter-and-made-her-pregnant-qvm4zu,['https://static.asianetnews.com/images/01f9jpcram14n1m4svxw0b9c66/vfvfdvsd-jpg_760x400.jpg'],"Fri, 02 Jul 2021 03:56:18 +0530"
